videoId,updateAt,authorId,cmt,label
4qNALNWoGmI,2023-03-13 12:09:22,UCLM81drx9hg0PSvKMt_DoeQ,Meoe meoe đáng yêu quá 💖🥰,0
4qNALNWoGmI,2023-03-13 12:10:37,UCnYehLhfXjK84xUXXo1JnIg,MV cuti wa aaaa💗,0
4qNALNWoGmI,2023-03-13 12:10:43,UC6JylWxuahX-iy1qBazKvcg,ny tao nghiện bài này rồi,0
4qNALNWoGmI,2023-03-13 12:11:20,UCMPBG8hzcqrt1MtQPvG6H3w,my my kìa :>,0
4qNALNWoGmI,2023-03-13 12:13:46,UCb03nZG_baaebnK7FiXtsFQ,Xin gửi món quà thân thương đến toàn bộ hooman~ vì đã góp sức cùng loài mèo và AMEO chinh phục vũ trụ 🐾🐾🐾💞   Gần 100 video sử dụng giai điệu ‘ưng quá chừng’ đã được chúng meow tổng hợp 😼 thách hooman tìm thấy mình trong loop version này đoá,0
4qNALNWoGmI,2023-03-13 12:16:59,UCRO8tHIaepEhVw9kBym6MZg,Quả nhạc gây nghiện quá,0
4qNALNWoGmI,2023-03-13 12:17:56,UCXBdbzT271LC_lScKz4wG1A,Eo mê vkl cj iu ưi😘😘,0
4qNALNWoGmI,2023-03-13 12:21:23,UC-7rWHbNr5g2xihDvtKvPjg,Trend mới rùi ae,0
4qNALNWoGmI,2023-03-13 12:23:40,UCwd8cqtiUv3ajAgmLCd7f8g,:)),0
4qNALNWoGmI,2023-03-13 12:23:53,UC_sB5ncSthJJ_KXrqULC6IA,Nhạc cute ghê 😍,0
4qNALNWoGmI,2023-03-13 12:24:07,UC7Z2WiSvn2Rx4pWiTImcS9g,Nhãn hàng tài trợ cho ra bản full dc kh ạ:)))),0
4qNALNWoGmI,2023-03-13 12:24:17,UCKLLVq9bp2mlVIV1Br-BdEw,Có nhiều mèo quá nè...,0
4qNALNWoGmI,2023-03-13 12:28:14,UCVcInpeSF4McQ4XeRtELp1w,meo meo meo,0
4qNALNWoGmI,2023-03-13 12:30:20,UCap-o05jZBvgXHrwdshd0ZA,Đây gòi <3 Hóng mãiiii,0
4qNALNWoGmI,2023-03-13 12:33:06,UCkb1E8hNnyNIZwlJd6cZWYA,Hết Jennie lại đến Newjeans,0
4qNALNWoGmI,2023-03-13 12:35:15,UCbT1hdQ_U2Mcu91g0pEYtpg,fan bé nâu điểm danh,0
4qNALNWoGmI,2023-03-13 12:40:59,UC1aWfLhAFNy6RdyP7QuHtvw,"Chiến lược marketing rất thông minh. Bài hát trending trước khi ra M/V và còn có nhiều cover clips. Một tiến bước của Tình Bạn Diệu Kì, cũng sừ dụng cover clips.",0
4qNALNWoGmI,2023-03-13 12:41:05,UCF3AgviKAjXNaDXkr3MbdIQ,mẹ nó qq cute dẹp ko coi nữa cute quá,0
4qNALNWoGmI,2023-03-13 12:43:26,UCF3AgviKAjXNaDXkr3MbdIQ,mẹ dễ thương dẫy,0
4qNALNWoGmI,2023-03-13 12:44:04,UC55SE1GqsAISKn3lCYSycBQ,hạnh phúc qué khi dc nghe full bài,0
4qNALNWoGmI,2023-03-13 12:44:53,UCj2bUC4W6DYK1Lbq-uY35VQ,nhạc cute vcl~~~~~~~,0
4qNALNWoGmI,2023-03-13 12:45:58,UCEI4-ZzxF3_ZsK9pDf5VqjA,Hóng Mỹ Diệu trong clip 🤣,0
4qNALNWoGmI,2023-03-13 12:46:28,UCJjIgNvmXKDCLJZwIHw9m1Q,Chúc mừng chị amee đáng yêu,0
4qNALNWoGmI,2023-03-13 12:48:58,UCdVHyxRNYEFrCrmyp0Zvb0Q,nhạc cutieeeeeeeeeeeeeeeeee,0
4qNALNWoGmI,2023-03-13 12:53:19,UCFz1OL4EOO6HBdLtxll88vQ,Yêu Amee quá😍,0
4qNALNWoGmI,2023-03-13 12:53:33,UCrJW_Ul68PNa6QSIYGLVxXA,"Mê Amee quá, xinh ơi là xinh",0
4qNALNWoGmI,2023-03-13 12:54:05,UCI4RZNu0bF7Vj4eox_2WeUw,Ôi quá cute 😍😍😍,0
4qNALNWoGmI,2023-03-13 12:57:33,UCndQkUngDDL3q0pspfMAECQ,t đã thấy quốc mẫu nha :)),0
4qNALNWoGmI,2023-03-13 12:58:02,UC9EQvsHWA0TqEZrUpV4in8Q,Nghe bài này t chỉ thất mắc cười 😂,0
4qNALNWoGmI,2023-03-13 12:58:33,UCUg8hfthsHF92_VTwk9BAtA,top 1 tren,0
4qNALNWoGmI,2023-03-13 13:00:56,UCcEr-6BrbwDMCufOCGV9bHg,Đây là chiếc mv đầu tiên mình xem sớm thế này,0
4qNALNWoGmI,2023-03-13 13:01:20,UC462ioY0wGBpIphZDdLPrbw,"bánh cuốn thiệt, nghe bữa h kh chán",0
4qNALNWoGmI,2023-03-13 13:06:37,UCwbjud7G-CtiD5vHjmuYG8g,meo meo meo meo,0
4qNALNWoGmI,2023-03-13 13:07:52,UCHeVmcX5xN2hon756M3gstQ,cute wá ❤,0
4qNALNWoGmI,2023-03-13 13:08:32,UCRzNGle6iuuDukdSAyaQhZg,có mỹ diệu kì mn =),0
4qNALNWoGmI,2023-03-13 13:09:26,UCHH_mps6qFck_JtzgY61dXA,có con nai héo tên nâu nữa kìa=)),0
4qNALNWoGmI,2023-03-13 13:10:33,UCzc3m7IuBhqF4SuXbKejnhw,"bài này hot quá ,  chúc mừng Kai và  Amee",0
4qNALNWoGmI,2023-03-13 13:11:04,UC-HvUpVpGp_esvaV_BvMM9w,iu qua di aaaaaaaa,0
4qNALNWoGmI,2023-03-13 13:16:25,UCAbg8FWcgLxqkA9KibE43uw,Mê giọng Amee,0
4qNALNWoGmI,2023-03-13 13:16:54,UCwq-VqExDahkhbGNQwL6ipQ,Ra MV đi ạ🥰,0
4qNALNWoGmI,2023-03-13 13:17:23,UCCiQ_w1SrwRavpB5m5iA-Cg,Nhiều bạn tiktoker chắc sẽ phải soi kỹ xem có mình trong MV ko (⁠ ⁠╹⁠▽⁠╹⁠ ⁠),0
4qNALNWoGmI,2023-03-13 13:17:28,UCaJFijb_EAIj4ZdzTVNGtqA,Có 1 sự bất ổn ko hề nhẹ ở đây là mặc dù bt lời bài hát là bắt đền đi nma e vx nghe thành tắt đèn đi ảo thật đếy:))),0
4qNALNWoGmI,2023-03-13 13:19:56,UCDYHaP-CuJM5BJTp-6Sz3og,cute quá tr,0
4qNALNWoGmI,2023-03-13 13:20:39,UC12JK8ErQu04zxqBamDoiaw,ui cute vậy saoooooo,0
4qNALNWoGmI,2023-03-13 13:21:06,UCkjz4HU3g0soc_jh2561RuQ,......-__+)+(-__-).....*,0
4qNALNWoGmI,2023-03-13 13:21:40,UCR-q_MaShrjywaVNJbqtTiA,Ối dồi ôi có chị Thái Độ kìa,0
4qNALNWoGmI,2023-03-13 13:21:49,UCWGO49y53x0mxsn9fL8_N6A,"Lời bài hát cho nhưng ai hệ điếc nhạc như mình ạ😂😂😂😜  Sao hôm nay, lại cứ ngẩn ngơ thế này Sao mà bây giờ đây, vũ trụ em chỉ thấy anh thôi đấy Bắt đền đi, trả lại tâm trí đâyy Meow meow meow meow, trả lại tâm trí tôi đây  Cứ như mèo con tắm nắng trong khu vườn nhà Rất trong lành, có ong Lòng em có anh Mới chỉ được gặp anh mỗi lúc ban chiều là ưng Quá chừng lòng em cứ tứng tưng tưng",0
4qNALNWoGmI,2023-03-13 13:22:54,UCBMJMe-9BT9WZFauLZchMsg,Ủa vậy bài nhạc này ngắn vậy thôi à :v,0
4qNALNWoGmI,2023-03-13 13:24:23,UCM-vxGhaCTJ-usXdXNyq_pQ,nhận ra mình coi gần 2/3 mấy cái clip tik tok trên video đúng là thao túng tâm lý,0
4qNALNWoGmI,2023-03-13 13:25:24,UCn9h_ImQihcC6WJSObzICpg,Ác vãi lồn,0
4qNALNWoGmI,2023-03-13 13:31:54,UCNqtSl8ECUrANy4mBzPlA4A,Nghe dài vậy có phải mê quá khum 😊🥰,0
4qNALNWoGmI,2023-03-13 13:34:17,UC-rLmfK1kOr72tDwmjZBQ9w,Nghe 1 đoạn bên tiktok quấn quá phải qua đây nghe full luôn,0
4qNALNWoGmI,2023-03-13 13:39:09,UCBxT3hNy6ZSqDxG8RLvbNkw,nghe nhu nhac han i=)),0
4qNALNWoGmI,2023-03-13 13:42:41,UC_nV9rIeZTFxEEv3oxixpjg,"bao h mới ra full vậy nhỉ, tạo trend là tốt nhưng mà nên tận dụng lúc trend đang lên để kích hoạt chứ cái gì cũng có chu kỳ cả ấy",0
4qNALNWoGmI,2023-03-13 13:44:14,UCuBQZNASgiFlyfNXD0_-Y-A,"Lan là con trai kìa, cưng quáaa",0
4qNALNWoGmI,2023-03-13 13:44:43,UCYC0JSD8iT_HfhV4TOYj7IA,Ame nhìn ngon cơm quá,0
4qNALNWoGmI,2023-03-13 13:48:05,UCzE9VjWF_j5EZgM3PyURTHA,aaaaaaaaaaaaaaaaaaaaaa tưởng 2p10 thui mà tận 5p17 luonnnn,0
4qNALNWoGmI,2023-03-13 13:52:53,UCp_vmVgIBSgPEdGwAFfjH0g,Nhạc cute thực sự <3,0
4qNALNWoGmI,2023-03-13 13:54:27,UC19wcSI368fVdTvE8a9HhbA,"Tuy cái marketing t nhìn ra nhưng vẫn bị cái nhạc thao túng tâm lý cơ, lần đầu mà t như này luôn đấy.  Biết là sử dụng TikTok truyền tải ok hơn, không những hơn mà nghiện mất rồiiiiii.  Không biết bản hoàn thiện là như đã công bố hay chưa đủ đầu tư để quay MV v 🥲🥲 tuy nghe v đủ rồi nhưng vẫn thiếu lắm, nghĩ vẫn còn, nên HÃY RA FULL ĐI Ạ🥲",0
4qNALNWoGmI,2023-03-13 13:59:06,UCzixcRZUBNH_FLJuQomVlOA,"Tính ra đây k phải bản full, chỉ là nó kéo dài ra hơn bth thui @-@",0
4qNALNWoGmI,2023-03-13 14:00:21,UCO9lccPN-fOINt5DBqigkpA,nhạc lol sẽ,0
4qNALNWoGmI,2023-03-13 14:04:06,UCR6vsGZCdCPmXI1i85xS9pg,.,0
4qNALNWoGmI,2023-03-13 14:07:33,UC0eNjOlU9tzZHLec5J24YNA,tự nhiên thấy mình và bồ mình trong vid =)))),0
4qNALNWoGmI,2023-03-13 14:09:56,UCUwS-x15KMvyiunh9agUgwA,1 siêu phẩm phải nói nghe nó phê nghiện không dứt ra được,0
4qNALNWoGmI,2023-03-13 14:15:24,UCcknO_HAY7V_W3iqOZ-rxCA,Đỉnh của chop. Nghe ngày 10 lần k đã,0
4qNALNWoGmI,2023-03-13 14:15:25,UCivFHxI8eokw9uIIIBKdfgQ,Đã thấy idol Bùi Quang Lan =)))))),0
4qNALNWoGmI,2023-03-13 14:15:58,UCttfgK-atnrecHYG5OLN7Kw,"Ủa r cái nhạc lặp lại v thôi á, thất vọng v tưởng ra full bài chứ🥲.",0
4qNALNWoGmI,2023-03-13 14:18:47,UC5xi7kLHCZE6Osk5hPA2lHQ,Cute thực sự <3,0
4qNALNWoGmI,2023-03-13 14:19:07,UCfsFk1ai4s1x5EHIPbjpQ5g,"Sao hôm nay, lại cứ ngẩn ngơ thế này  Sao mà bây giờ đây, vũ trụ em chỉ thấy anh thôi đấy  Bắt đền đi, trả lại tâm trí đâyy  Meow meow meow meow, trả lại tâm trí tôi đây    Cứ như mèo con tắm nắng trong khu vườn nhà  Rất trong lành, có ong  Lòng em có anh  Mới chỉ được gặp anh mỗi lúc ban chiều là ưng  Quá chừng lòng em cứ tứng tưng tưng    (TONE UP)    Cứ như mèo con tắm nắng trong khu vườn nhà  Rất trong lành, có ong  Lòng em có anh  Mới chỉ được gặp anh mỗi lúc ban chiều là ưng  Quá chừng lòng em cứ tứng tưng tưng",0
4qNALNWoGmI,2023-03-13 14:21:13,UCWnO2XfH5PX-F4PEriZyZ5g,dẽ thương vá,0
4qNALNWoGmI,2023-03-13 14:25:12,UCEBUFCOOyN8fXri2oXH3wZg,Nghe bài này bỗng dưng nghĩ đến tướng ngồi bầy hầy của con Mỹ Diệu là sao vậy trời 🥲,0
4qNALNWoGmI,2023-03-13 14:25:38,UCLvNV0QKsLmnyAlV2dwXq0A,mẹo meo meo,0
4qNALNWoGmI,2023-03-13 14:26:47,UC8o6LGTNXKTh0QgVZqPe7wA,1:07 trời ơi idol mỹ diệu của em =),0
4qNALNWoGmI,2023-03-13 14:27:34,UCTGGVrlw7R5UWC-_Mfx9k5Q,Mình nghe luôn bản loop 1h chứ được 5p nhằm nhò gì:)),0
4qNALNWoGmI,2023-03-13 14:28:15,UC2XaMc1zU13rILbqDpggyWQ,hay wa đi thoi ạaa,0
4qNALNWoGmI,2023-03-13 14:30:03,UCDMM-mB5dvMDjDn8_Ag1zXg,Tui đã thấy mỹ diệu,0
4qNALNWoGmI,2023-03-13 14:30:05,UC7ZXs6tDtQFQ-j7FXYL-pgw,"đoán y luôn lần này Amee sẽ ra mv sau để lấy clip titkok thặc sự rất muốn đu luôn nma chưa thể thoát ra khỏi vùng an toàn, mv tuyệt quá chúc Amee đạt top trending nha",0
4qNALNWoGmI,2023-03-13 14:31:12,UCZGzvSSF-xdsEKZ9wLp3x9A,thí có nhỏ Nâu với Lan béo là thí MV cuti gòi đó =))))))))))),0
4qNALNWoGmI,2023-03-13 14:36:14,UCQX14G1cdGwQ4xakA7vk1Yw,marketing nghệ cả củ,0
4qNALNWoGmI,2023-03-13 14:39:21,UCizh4rZ8iW5IOfnbnPhRP4Q,Ô anh lan đz kìa mèo meo,0
4qNALNWoGmI,2023-03-13 14:39:30,UCvSNmn7PvdvgKwg4Gnu05vA,bài này nghe yêu thật sự,0
4qNALNWoGmI,2023-03-13 14:39:41,UC6ObyvqfYpT5__fjTK6Qgng,Đở tốn chi phí với tiền mướn cats hen,0
4qNALNWoGmI,2023-03-13 14:39:51,UCUZbB1SnQhP_GPA0TLYp3rQ,"quả nhạc mà mấy bạn trường em dùng để nhảy ngày hội trại luôn, lúc nào đi qua ktx là nghe nhạc này",0
4qNALNWoGmI,2023-03-13 14:51:10,UCZ6sXwu1VpiRF8Ys08pavvQ,mèoooo nhìu vãi😆,0
4qNALNWoGmI,2023-03-13 14:57:15,UCY3MZkwxCr9p2GZCk5glU0A,Ra full bài này đi mà năn nỉ,0
4qNALNWoGmI,2023-03-13 14:58:52,UC_tpz76xba0L50kV7WfNMtw,Quá hay luôn,0
4qNALNWoGmI,2023-03-13 14:59:45,UCimZl4vNBEXbCM6xkj8KTQw,"bài này quảng cái cho Sunplay nên chắc ko đầu tư MV đâu, chỉ MV special như này thôi à",0
4qNALNWoGmI,2023-03-13 15:01:30,UCJDFxViO8ey5Fh1Sh1vtS-Q,ko biết ai sao mà m nghe chán ghê chả có cảm xúc lun,0
4qNALNWoGmI,2023-03-13 15:02:21,UC2wSYFcWxoi1aHj0PWfME1w,Chị amee hát hay quá,0
4qNALNWoGmI,2023-03-13 15:09:29,UC22KFU5IKvquLfWOwkGgmuQ,xóa tiktok r nhưng vẫn thấy mê bạn MyMy=)))),0
4qNALNWoGmI,2023-03-13 15:12:16,UCzXpvHQ0G4bh4vVN67i3oKg,cưngg,0
4qNALNWoGmI,2023-03-13 15:14:00,UCKrxgP_lTecqZ-ptb5iO8lA,ưng extrim quá chừng :< mai qua chăm giày thui,0
4qNALNWoGmI,2023-03-13 15:14:29,UCGzg28GZph5kcQ2N8tduyRw,Đây là một bài hát đã nằm trong top trending của TikTok Việt Nam trong thời điểm hiện tại luôn đó!,0
4qNALNWoGmI,2023-03-13 15:15:30,UCWWImbo6yUdRNjQAC4l7PeQ,Mê 🥰,0
4qNALNWoGmI,2023-03-13 15:15:35,UCrQNvstJNAs7j-z_9Xdd_KA,vợ của bé cuti quáaaaa,0
4qNALNWoGmI,2023-03-13 15:15:42,UCixlcZg_94b16nBRN8t-rJA,Ưng Amee quá chừnggg💗,0
4qNALNWoGmI,2023-03-13 15:18:20,UCc1y6QBty29Ks8qthIBnaiw,.,0
4qNALNWoGmI,2023-03-13 15:23:39,UCZIps0yWRgG5vp7CVqgW28Q,Không thích Amee tí nào mà éo hiểu sao bài quỷ này trong đầu hoài không dứt được :)))),0
4qNALNWoGmI,2023-03-13 15:31:45,UChllQbgtwDuuUPjw9KPJY7A,meediệu :v,0
4qNALNWoGmI,2023-03-13 15:50:01,UC-EGcTN_acJLYmCpmSoGBQg,Bắt chước 100% phong cách newjean bên Hàn thì cần gì mướn stylist làm gì nữa hén?? 😂😂😂,0
4qNALNWoGmI,2023-03-13 15:55:35,UCYqPei1hh_aQbwR3zZKRtsw,"bài này vừa hay vừa dễ gây nghiện, đặc biệt là đối với những người yêu mèo 😽, mik chờ mấy bài kiểu này lâu lắm rùi mà giờ mới đc nghe🤭. Cảm ơn AMME đã mang tới một bài hát hay cho những người yêu mèo như mình 😻",0
4qNALNWoGmI,2023-03-13 15:56:49,UCvVv32hr295ZZSeV4c_tQ_Q,"nghe như nhạc cute Nga, Nhật Bản haha",0
4qNALNWoGmI,2023-03-13 16:05:20,UCGSTVfUObsoz2xaRcpSHFtQ,tôi thấy bùi quang lan,0
4qNALNWoGmI,2023-03-13 16:05:56,UChJIDvnsm1EmBfC8BpNkx_Q,Hay quá chị 💖💖,0
4qNALNWoGmI,2023-03-13 16:06:10,UCJO044RBh48qDFsYHQgp9hg,r hay dữ chưa ?,0
4qNALNWoGmI,2023-03-13 16:15:24,UC6TtjAemdaS-iQBwleX5uDw,"OGGY GIRLS, tinaThaoThi 🤣🤣",0
4qNALNWoGmI,2023-03-13 16:15:28,UComMIq5cE-4VLgR8Ltr7DFg,hay qua,0
4qNALNWoGmI,2023-03-13 16:16:34,UCfGvCtM7vmRplu6ZaOvYFDw,Nhạc cute quá~~,0
4qNALNWoGmI,2023-03-13 16:29:27,UCkHAtJwa4rF1KCZAVc6Crcw,Tự nhiên thấy chị Nâu là tui tỉnh lại liền,0
4qNALNWoGmI,2023-03-13 16:34:51,UCTEklfDgtg4cvM54jJINlZw,cuti quá,0
4qNALNWoGmI,2023-03-13 16:39:45,UCs_NNNvPQuolpF5BAw3kidg,Phong cách giống newjean thiệt. Mà cũng hay,0
4qNALNWoGmI,2023-03-13 16:50:57,UCX48UrFWUugUPM0qtUlUsMw,ai bật đèn cái tối quá,0
4qNALNWoGmI,2023-03-13 16:57:14,UCYwgL6mWsLXOHkbHXOGGYnw,cuti,0
4qNALNWoGmI,2023-03-13 17:01:47,UCUQ6mVwVx3kS0_4D8JU3VzA,raaaa rồi lalaa,0
4qNALNWoGmI,2023-03-13 17:22:28,UCDUOnR1U_TtMj8bArSgFK1w,Moa,0
4qNALNWoGmI,2023-03-13 17:34:52,UCAO47iVYRRB2SkQ0IQdBFSQ,Thấy Lan với Mĩ Diệu rồi nha ❤,0
4qNALNWoGmI,2023-03-13 18:03:55,UCX4iX06fQcfS3eF2mBiUj0Q,Ơ kìa Lan ditto cũng xuất hiện ò 🙄,0
4qNALNWoGmI,2023-03-13 18:28:51,UCVCOLcm1Nwn80NPJ8J0gKuw,Bài hay đã dị đúng tâm trạnh của mình 😚,0
4qNALNWoGmI,2023-03-13 18:46:03,UC_cg32GBebk661oBmBUWxqw,TAO ĐANG NGHE CÁI ĐÉO GÌ VẬY,0
4qNALNWoGmI,2023-03-13 18:47:10,UCDtos27ykcs_96nkcYcrsnQ,Tự nhiên t thấy bà Nâu vs bà Mỹ Diệu t tỉnh lại liền :)),0
4qNALNWoGmI,2023-03-13 20:29:10,UCITwrdLUeXlm1wtUNjvPQJQ,đây roi em đợi mãi ❤,0
fyMgBQioTLo,2023-03-13 00:18:10,UCFuD8ifmNyKdpJMRVvI7ZJw,Hi,0
fyMgBQioTLo,2023-03-13 01:30:30,UC3HukFypH3PzE4oA2Hv06lQ,Tlinh ra bài nào bài đó hot,0
fyMgBQioTLo,2023-03-13 01:52:46,UCTg4plWPdRU0zLplyqo3fFA,Nếu lúc đó mình nắm chặt tay nhau thì có lẽ chúng ta đang ở SG 2h đêm,0
fyMgBQioTLo,2023-03-13 02:44:47,UCcozdIfR10aw9V1r8UugtSA,03:50 0 ai nghĩ,0
fyMgBQioTLo,2023-03-13 02:57:23,UC6KVLcUNBomeolTD_DsyeSw,Người gì đâu mà zừa đẹpp zừa giỏi là sao z hả trừii,0
fyMgBQioTLo,2023-03-13 03:27:42,UC3N5LA9qk8kkLXQjQIrXOEw,01:00,0
fyMgBQioTLo,2023-03-13 03:36:00,UC5AFwCGPZ7Vf78cFw-RGG4g,Lyrics hay-beat quá đỉnh  😍😍2pillz Càng ngày beat của 2pillz càng level up🥰🥰🥰,0
fyMgBQioTLo,2023-03-13 03:41:19,UCUxGv2f2SdC5ryZp1pW5BDA,Quá hay luôn. Rất mê emmmmmm,0
fyMgBQioTLo,2023-03-13 03:50:37,UCTIJQzLt-FCMoX2mwT6EOfA,Cảm thấy bài này hay hơn bài GIDCEO,0
fyMgBQioTLo,2023-03-13 04:16:58,UCjabujAcnjCKzeJBBnybsrQ,Nổi da gà luôn 😢,0
fyMgBQioTLo,2023-03-13 04:21:05,UCis1lhui4v3newHd2PJYZLg,💓,0
fyMgBQioTLo,2023-03-13 04:45:11,UC0FS_4TMn_PP_qDUj0pZbkg,this is the english comment ure looking for =))),0
fyMgBQioTLo,2023-03-13 04:58:49,UCY_LLWPEZtHspiQYQ3TeOKQ,tlinh về đội spayspeaker là đẹp,0
fyMgBQioTLo,2023-03-13 05:29:15,UCFoUFbvlPIhwil20JIGRAVQ,rác âm nhạc!,0
fyMgBQioTLo,2023-03-13 06:33:51,UCY3ncBLkCDQPPxYl40r6tVQ,Nghe khóc luôn,0
fyMgBQioTLo,2023-03-13 06:40:43,UCx4goD08VUCa1GI9AxjGslw,"Mình khá thích 2 hình ảnh trong MV này của TLinh, đây cũng chỉ là suy nghĩ, trí tưởng tượng của riêng mình. - 1 là hình ảnh ở nữa đầu MV khi mà TLinh mặc chiếc váy màu hồng, khóc lóc, gào thét sau đó thì có những người không mặt bao bọc lấy TLinh, nó làm mình liên tưởng tới 1 bông hoa đang khép mình lại vì những tổn thương mà bạn ấy đã chịu đựng, hoặc cũng có thể là đại diện cho những người thân, bạn bè đã ở cạnh vỗ về, an ủi, hỗ trợ TLinh khi b ấy đang trải qua giai đoạn khó khăn, khủng hoảng. - 2 là hình ảnh gần cuối MV khi TLinh một mình vén tấm khăn voan lên, làm mình có cảm giác nó biểu thị cho việc b ấy đã dần vượt qua được khoảng thời gian khó khăn, cũng như những nổi đau mà bạn ấy đã phải chịu cũng đã dần vơi đi, hiện tại b ấy đã có thể mở lòng mình hơn, đón nhận những hạnh phúc, những thay đổi tích cực.",0
fyMgBQioTLo,2023-03-13 06:41:31,UC-JCgNX_WzCKaWb4hde1Y1g,"Lời rap nhảm nhí , giọng ca k rõ lại còn....  video thì ..... .( nhận xét tiêng)",0
fyMgBQioTLo,2023-03-13 06:42:47,UCiC5pgNNeWeQdv_4TsZtBOg,.,0
fyMgBQioTLo,2023-03-13 07:40:01,UCw_BOnnGF4JB-03qXb2RK5A,"Trào nước mắt ngay từ lần nghe đầu tiên. Thương Tlinh và MCK vì 2 bạn đã phải hứng chịu rất nhiều từ cđm. Respec 2 bạn vì sự tôn trọng sau tất cả mà 2 bạn dành cho nhau. Nhất là Tlinh, em khiến người nghe thấu hiểu và đồng cảm qua âm nhạc của em. Càng ngày càng đỉnh❤",0
fyMgBQioTLo,2023-03-13 07:44:33,UCmUtOKH4eYFr6L90a0vPLfQ,1,0
fyMgBQioTLo,2023-03-13 07:54:15,UCVngbTqxenmBZVe5RM8WERw,"bài hát nói lên hết cảm xúc những gì tlinh đang trải qua rồi, cảm ơn chị, thực sự thấm",0
fyMgBQioTLo,2023-03-13 08:04:23,UCusWXAxuk31ewWOSUcaSXgA,"Eso es muy maravilloso !!! ¡Obviamente, si llegamos a los 100 millones, ELIJALO para seguir desovando! Casi se llega a la meta 💖💖💖💖💖💖",0
fyMgBQioTLo,2023-03-13 08:04:41,UCusWXAxuk31ewWOSUcaSXgA,"Eso es muy maravilloso !!! ¡Obviamente, si llegamos a los 100 millones, ELIJALO para seguir desovando! Casi se llega a la meta💖💖💖💖💖💖",0
fyMgBQioTLo,2023-03-13 08:14:25,UCD6C-wnuPyzn4JEaBetek4A,"Tôi ko hiểu tình cảm của 2 bạn, tôi ko hiểu mọi thứ xung quanh ra sao .Nhưng mà cảm ơn 2 bạn , cảm ơn tất cả mọi thứ mà bạn đã đem lại.Vô cùng yêu quý và luôn mong cho mỗi người thật hạnh phúc.",0
fyMgBQioTLo,2023-03-13 08:23:15,UCxEjqnxQRIWzFRh3PYH-nOw,VTV đã xem,0
fyMgBQioTLo,2023-03-13 08:54:18,UCh2NaTC1JljXKSzhhO8JV9A,độc thoại hay quá em ơi...thêm 1 ver english nào :),0
fyMgBQioTLo,2023-03-13 09:53:22,UCvk1YkazlI7FrRRrikY464w,nge hay quá,0
fyMgBQioTLo,2023-03-13 10:17:38,UCcJG4mv4AiKwCfaVdNPiwTg,bài này mà có suboi nữa là 10đ ..tiếc quá,0
fyMgBQioTLo,2023-03-13 10:48:23,UCNOr6oebiZyAXqsyNjk7nxg,^^,0
fyMgBQioTLo,2023-03-13 10:51:10,UCHhcHTzuTfohbzmioGZFh9Q,사랑해 오빠 ♡  . 나중에 꽃 필때 만나자 ㆍ,0
fyMgBQioTLo,2023-03-13 11:35:54,UC8Ak2EoEqgHiyPbRo93JG2g,đỉnh của chóp nghe cuốn,0
fyMgBQioTLo,2023-03-13 12:02:17,UC7uO38yK98hyR24b9RhabUQ,"Thật sự là nhạc k phải khen quá nhưng dạo này mình nghe bài này của tlinh hầu như hết ngày, cảm giác nó rất là phiêu và hay",0
fyMgBQioTLo,2023-03-13 12:09:08,UCPaFpT_Wu8fC9rMhFjGSFmQ,¡¡¡realmente lo disfrute!!! Espero que hagas muchos buenos productos !!!❤❤❤,0
fyMgBQioTLo,2023-03-13 12:34:31,UCSP8bBr7lzO2NNd6Rcm_OLw,dù aii có gétt tlinh thì tui vẫn mãi keooo,0
fyMgBQioTLo,2023-03-13 13:05:09,UCkYJaLsioH9mMuSlF5xVs2g,"Es genial, espero que el autor lance más productos!!!",0
fyMgBQioTLo,2023-03-13 13:14:38,UC1bXg0NBuJCIxG9W39eE9zQ,Lời bài hát giống hoàn cảnh của em quá chj iu à 😥,0
fyMgBQioTLo,2023-03-13 13:25:13,UC8mmsATPgSMcxZSZGV0D4UA,Nghe cuốn quá:-D,0
fyMgBQioTLo,2023-03-13 13:41:13,UC8bldpKiHYmdeQf8-7gwSzQ,K hiểu sao qua buồn thì nghe hay còn khóc theo..sáng dậy thấy bth lại xong cày lại thấy ngang ngang.. Còn đang tự hỏi k lẽ do đt bị gì..lên pc cũng v.. Nhưng mà xưa h vẫn thích nghe b Tlinh hát vì hát hay qá tr,0
fyMgBQioTLo,2023-03-13 14:00:00,UCZivanZhebOBd6zKfO1fHCQ,Xem clip tlinh gào thét real life trông tội bả gê,0
fyMgBQioTLo,2023-03-13 14:06:12,UCuy1kkkcYlmiNye5JymKJ2g,nghe đau lòng vãiii,0
fyMgBQioTLo,2023-03-13 14:28:04,UCvJ3sS9sbjqQIxPRwYAo4Ug,..,0
fyMgBQioTLo,2023-03-13 14:29:14,UCBEn3SljKwTD6CDA0ATDoCg,nghe thấm như tương ớt chin-su trên đĩa thịt bò vậy 😭,0
fyMgBQioTLo,2023-03-13 14:35:41,UCeoYuXVUMAW-iNU_uvrp1PQ,Hay❤,0
fyMgBQioTLo,2023-03-13 14:36:07,UCMjoBvjMf3wwcCOuSUfq1HA,khi nào có link hát live cho lên nha ad,0
fyMgBQioTLo,2023-03-13 14:39:42,UCDe5Unpdqhhlz7tDG3-9sxw,VTV Đã Xem,0
fyMgBQioTLo,2023-03-13 14:47:18,UCRCZ3adZVumFIJfhkK1jf_A,"việc chờ đợi hồi âm từ một người gieo cho mình hy vọng chữa lành, đã khiến trái tim mình mạnh mẽ hơn, tập trung vào công việc để ko trở thành kẻ bám đuôi tình cảm người khác... sau cùng, mình kết luận nên yêu người yêu mình chứ bớt tâm sức vào người mình yêu ạ! Nếu họ ko đầu tư thời gian, tiền bạc cho bạn, nghĩa là họ ko đủ thích bạn đâu mà có thể bạn đã sự lựa chọn thay thế/lấp đầy trong tim họ đấy.  Cám ơn bài hát vì mình dường như bước ra khỏi mqh toxic, lầm đường, quay về thực tại. Biểu hiện rõ nhất là mình không còn chờ đợi/trông ngóng/hồ hởi khi thấy tin nhắn, tin tức về người đó xuất hiện trên newfeeds mình nữa.  Thứ lỗi cho em, em mong anh cũng vậy!",0
fyMgBQioTLo,2023-03-13 14:47:54,UCb7-_HKnZOr2XfMsauugqig,"tling ko lụy,mck ko lụy,ai lụy.T lụy='))",0
fyMgBQioTLo,2023-03-13 15:07:04,UCJDFxViO8ey5Fh1Sh1vtS-Q,vô vị,0
fyMgBQioTLo,2023-03-13 15:30:22,UCrg1z4EjZ9RsP0JZNk7_8kA,hii,0
fyMgBQioTLo,2023-03-13 15:32:37,UCveHEAZ8GaIH3cNJ3mxIKZw,.,0
fyMgBQioTLo,2023-03-13 15:42:55,UCYC0JSD8iT_HfhV4TOYj7IA,Ok,0
fyMgBQioTLo,2023-03-13 15:43:06,UCYC0JSD8iT_HfhV4TOYj7IA,Good,0
fyMgBQioTLo,2023-03-13 15:57:34,UCxajgd--0Sw0vprMXP17QnQ,Mọi người cũng đã khen chị hết rồi!! Còn e chỉ biết nói là TUYỆT VỜI ❤❤❤,0
fyMgBQioTLo,2023-03-13 15:58:33,UCcGiaeiPjjCBUHHMh7ViwpA,Hay,0
fyMgBQioTLo,2023-03-13 16:54:03,UCVRBan-CVj5Xvg6CAr9ShJA,💖🫀,0
fyMgBQioTLo,2023-03-13 17:00:16,UCb6aYy-vQB3Pd3mO0c274fg,Riêng mình thấy bài này chả hay gì cả. Lời có phần thô. Hiện nay Nghe bài cuối cùng thì hay thị mầu hay hơn nhiều.,0
fyMgBQioTLo,2023-03-13 17:21:11,UC2taA6gaVpSqXJ7zVt4azyQ,bài này chắc 100 triệu view mất thôi!,0
fyMgBQioTLo,2023-03-13 17:34:11,UC9Lt-iDosqleQYwF-WsVnKA,"Giờ nghe bài này mới thấy thấm thật đấy, từng lời từng lời như cứa vào tim ấy",0
fyMgBQioTLo,2023-03-13 17:42:40,UC_9OQIlz9B1QAOPlIozGOfg,vl bài này hay không từ ngữ nào diễn tả đc,0
fyMgBQioTLo,2023-03-13 18:12:26,UCkvxysf9bVyw1iCN5FXrbow,hay,0
fyMgBQioTLo,2023-03-13 20:15:50,UCdRSzrSwDOBKrMBC7DOYD1A,hay cực❤,0
fyMgBQioTLo,2023-03-13 20:51:19,UCXLYx6QjHXovvTyaWQBg-CA,Hay lắm Tlinh,0
fyMgBQioTLo,2023-03-13 21:37:26,UC3GMVZbAJYYVzBRajIbHfvA,Hay vãiii Linh,0
lB3SRFPYf98,2023-03-13 09:01:01,UCty4q95TkeEQjN7ic2Y5gow,Cùng đếm ngược thời gian đến 20h ngày 14/3 để cùng xem công chiếu MV với chúng tớ nhaaaa ❤❤❤,0
lB3SRFPYf98,2023-03-13 09:03:38,UC7AzWd02Vpo9BSsYwt627gg,FINALLLLLLLLYYYYY!!!!!!!!!!,0
lB3SRFPYf98,2023-03-13 09:04:37,UCzYRzemFWKNessiI0_T1WPw,"Sau thành công của Anh Đã Từ Bỏ Rồi Đấy thì tôi xin gửi đến anh em một Hẹn Em Ở Lần Yêu Thứ Hai nữa. Sản phẩm lần này bọn tôi đã cố gắng hoàn thiện nó tốt hơn Anh Đã Từ Bỏ Rồi Đấy về mặt âm thanh và hình ảnh. Tuy nhiên phần nội dung MV có thể sẽ không bám sát được theo câu chuyện tui đã viết, mong mọi người thông cảm cho bọn tui nhaa. Về phần nội dung câu chuyện chỉ đơn thuần là những suy nghĩ của chính tôi, và nhiều anh em đang trong độ tuổi chông chênh, lo toan về gia đình, sự nghiệp, tình yêu nên đôi lúc bỏ lỡ đi người mình yêu nhất bằng chính sự vô tâm của mình. Tôi mong anh em luôn tìm đến nhạc của Nguyenn để nghe về một tình yêu đẹp. Sau một mối tình đổ vỡ, vẫn còn đó những kỉ niệm mà khi nghĩ về nó ta lại không kìm được nước mắt... HEOLYT2 - Nguyenn x Đặng Tuấn Vũ | 1403",0
lB3SRFPYf98,2023-03-13 09:15:14,UCcRCoLqoQlZtNIpiHYgqPLg,aaaaaaa ngồi hóng thoiiiii🤩,0
lB3SRFPYf98,2023-03-13 09:52:37,UC_hCg49kNLYu2MWBk0fyXJQ,Bay từ tik tốc qua đây hóng lun,0
lB3SRFPYf98,2023-03-13 09:58:16,UCzYRzemFWKNessiI0_T1WPw,Anh em nào muốn xem lyrics có thể bật phụ đề nhaaa❤,0
lB3SRFPYf98,2023-03-13 10:10:54,UCyG2dpBL8rKX9DGs1ikWZHQ,Lụm lụm lụm lụm lụm lụm,0
lB3SRFPYf98,2023-03-13 10:15:47,UCzh6i3aR6azThtMZqpCpKQw,"Chán, đặng tuấn vũ hát không hợp bài này, nếu bạn tự hát sẽ hay và nhẹ nhàng hơn bạn làm vậy chỉ tự phá đi bản hít của mình mà thôi",0
lB3SRFPYf98,2023-03-13 10:45:23,UCL3lxWhnGKWFZOvTRIzU4xA,Rồi ngày này cũng đến 🤣,0
lB3SRFPYf98,2023-03-13 11:18:25,UCudFu86AmI_KPk-cil1Al6g,Hóng quá trời,0
lB3SRFPYf98,2023-03-13 12:08:33,UCYuB11g0E_zz2C1iBmr-x5g,Sp này phải 2tr view nhé chú ưiii,0
lB3SRFPYf98,2023-03-13 13:11:09,UCm21ZEqCXF2cnHXKX-RUbGw,hóng thôi,0
