videoId,updateAt,authorId,cmt,label
0Mr3CqCDq3o,2023-03-28 00:59:42,UCosDohpxFCfTI2CvoBn5rJw,"Ko cầu kỳ, miễn sáng tác ok và hát hay là được rồi ❤",0
0Mr3CqCDq3o,2023-03-28 01:20:22,UCBymQklwCL7xwGGorkAXfAA,❤❤,0
0Mr3CqCDq3o,2023-03-28 01:48:40,UCW94q7fBni7qjHawfB3ykfw,Hây lắm em ơi,0
0Mr3CqCDq3o,2023-03-28 01:55:47,UCSH-sexrqLgQhC9zTeHwpVA,nhạc phẩm quá hay! ca từ giai điệu đều rất lạ ~ Chúc MV đã lên top thịnh hành ạ <3 Top 1 thịnh hành go gooo,0
0Mr3CqCDq3o,2023-03-28 02:16:47,UCgEntiC9nWpHwnwgygV3Bnw,Hay quá ạ,0
0Mr3CqCDq3o,2023-03-28 02:18:14,UC1yh9r_YwWV-TOVp9occdMQ,Cây đu đủ kìa,0
0Mr3CqCDq3o,2023-03-28 03:02:00,UC9hxcKAEsDJJQoHxyhtGwhw,Nghe hoài ko chán,0
0Mr3CqCDq3o,2023-03-28 03:24:09,UCvyFwSKYsmNzeqZDZFb4CXQ,nhac vui qua . Mong cos nhieu bai nhu vay nhe,0
0Mr3CqCDq3o,2023-03-28 04:14:28,UCvxsx_ubJTZk7Kd9taVRMsA,hay quá đi,0
0Mr3CqCDq3o,2023-03-28 04:14:45,UCnnkcqhhHlzZgNu8uNs16MQ,Thích mấy bài nhạc như này ghê ❤❤,0
0Mr3CqCDq3o,2023-03-28 04:37:58,UCtS5io9p5Mu1LIclmOxw9eA,"2-3 con vịt, tặng em gạ...",0
0Mr3CqCDq3o,2023-03-28 04:54:15,UCIU574gx6laEWx_P97ehcaA,Người miền tây mãi đỉnh❤❤,0
0Mr3CqCDq3o,2023-03-28 05:05:49,UCm5P47v_JJlMjZxeGrXyfCQ,Bữa nào Ra nhạc miền tây giống như diệu kiên đi em trai ơi 😊,0
0Mr3CqCDq3o,2023-03-28 05:24:20,UC64HnCSBDooxnq0cDamlC6A,"Nal dễ thương hòa đồng, miền tây, nghe nhạc là tôi rất thích luôn. Còn cái thằng jack gì đó mặt láo láo sống điểu ghét lắm. Nhạc nó cũng ko nghe . chả có ý nghĩa gì.",0
0Mr3CqCDq3o,2023-03-28 06:12:32,UCB5Rk1uv3HIcnHUX880_itA,Nhìn mộc Mạc dễ thương gì đâu,0
0Mr3CqCDq3o,2023-03-28 06:13:00,UC27JinoZzAXuExAYtw22K7w,Âm nhạc hoà  hay tuyệt vời,0
0Mr3CqCDq3o,2023-03-28 06:18:39,UCZLxTcZjRWZFBKtleE1pJnw,ai thấy quả nhà lá quen quen ko : ),0
0Mr3CqCDq3o,2023-03-28 06:36:49,UCdE1KDq8V48BNwEvtWar6nw,nhạc miên tây lên ngôi,0
0Mr3CqCDq3o,2023-03-28 06:47:52,UCg3PPqs_b9Lxvqh55_JI86Q,Có Hồng Chi nữa ta💐💐,0
0Mr3CqCDq3o,2023-03-28 06:52:04,UCZC9SCcS4N5MCzq_uXqoWMA,chân thật quá nhớ  miền tây rồi,0
0Mr3CqCDq3o,2023-03-28 07:01:18,UCqB_635o29APF7274397cqw,Nhớ ngày xưa ghê,0
0Mr3CqCDq3o,2023-03-28 07:05:07,UCYugSpyF7Tmh_KoELgSKzvQ,Mong sự kết hợp của bạn và Diệu Kiên,0
0Mr3CqCDq3o,2023-03-28 07:11:37,UCMbM5j-ZlRktmroOTOY1KMw,Náo loạn cả tik tok 😂,0
0Mr3CqCDq3o,2023-03-28 07:15:11,UCM6ghZ3MZD1njtD0o7nKwTw,mv kiểu như hồi xưa vậy á mình rất thích nhaaa,0
0Mr3CqCDq3o,2023-03-28 09:03:36,UCCYU46Af4DvcVJvHPgMswVA,Nal cute quá à! 😊,0
0Mr3CqCDq3o,2023-03-28 09:17:46,UCLYO59rqG0icyJj_kXAplMA,Idol.nhạc vẫn hát vẫn sáng tạo nhiều và hay.nhưng ko quên kèm  bản sắc kmer.dù như thế nào. Vẫn giữ được bản sắc. ❤😊,0
0Mr3CqCDq3o,2023-03-28 09:49:07,UCoDgS7BmaE7WLJtR166LMVw,很好听,0
0Mr3CqCDq3o,2023-03-28 10:55:20,UCnOfqqcQEeZe7E1YGXK9o2Q,Nhạc hai Nal anh ❤,0
0Mr3CqCDq3o,2023-03-28 10:56:05,UC6kj6AsT_qbjE19FYjBfp5A,Mình nghe bài hát này giống như mình cách đây khoảng mười mấy năm vậy bài hát rất hay chúc nal thành công,0
0Mr3CqCDq3o,2023-03-28 11:27:34,UCmpYAeLF_ED_U6aUcaLVRqw,"MV xuất sắc nhất tháng.LÂU rồi ko thấy có MV nào chất bộc lộ dc nội dung bài hát như vậy,",0
0Mr3CqCDq3o,2023-03-28 11:31:58,UCCl-M4GYoXBEN5V248BMjGQ,lời hay nh nhạc thì tệ,0
0Mr3CqCDq3o,2023-03-28 11:32:56,UCGwOf9LaxeuI1CWJm_N4BAQ,càng mộc mạc càng thích,0
0Mr3CqCDq3o,2023-03-28 11:38:40,UCpWLNAkrEsxkN0GUWl-R21g,hay hay hay❤❤,0
0Mr3CqCDq3o,2023-03-28 11:51:45,UCNkgYNzaxgOsAmCITfnpr7A,Chòi ơi dẽ thương quá Anh uiiiii,0
0Mr3CqCDq3o,2023-03-28 11:56:07,UCi0TQEooQmFwx2BkcHwzuvQ,Làm mv ít tốn kém ghê.haha,0
0Mr3CqCDq3o,2023-03-28 13:11:22,UCDogI2tbDpFJ2_XDoOfBD0w,Ra kâraoke chắc đã,0
0Mr3CqCDq3o,2023-03-28 13:15:42,UCRuSV38A_a_Kz2EYzfyXV2Q,Hay lắm bạn ơi tiếp tục phát huy nhé 🤗,0
0Mr3CqCDq3o,2023-03-28 13:31:52,UCoHSemCgGsfx63t0DpEhQ_Q,Chúc mừng mv lên top,0
0Mr3CqCDq3o,2023-03-28 13:42:07,UCktI0EOnbaWue5pu8xScGqg,Đúng chất Miền Tây luôn anh êi,0
0Mr3CqCDq3o,2023-03-28 13:50:24,UC6mznO5IlsjwQxlE-WD1lKQ,Cô thắm này đẹp nha😂,0
0Mr3CqCDq3o,2023-03-28 14:04:20,UCPuNjncjZimF8vE3YUtTuew,"Éo tin được , mấy ông già xóm tui ổng hát suốt",0
0Mr3CqCDq3o,2023-03-28 14:39:33,UCpNrwABPPHPTCD-PivF1tGA,10 đ,0
0Mr3CqCDq3o,2023-03-28 14:58:15,UCs4wlCwzdj-2PcpZ1qx2C3w,Để ý cái nhà này giống trong MV Sóng Gió,0
0Mr3CqCDq3o,2023-03-28 15:09:16,UCvgLEA-_ZR6-sFXf8AYy17Q,Hay qua a ơi ❤❤,0
0Mr3CqCDq3o,2023-03-28 15:47:18,UC7MpF4dxCM0SK8N40A0pwnA,cho con vit ve danh tiet canh mat,0
0Mr3CqCDq3o,2023-03-28 16:27:11,UCmai4i-AHMQVDQLEJ8zN18Q,Chúc mừng MV lần này đã đạt top4 thịnh hành anh Nal nha,0
0Mr3CqCDq3o,2023-03-28 16:30:04,UCF7ueo6vmc5NbQ6_fzD8jZw,hay,0
0Mr3CqCDq3o,2023-03-28 16:32:05,UCTXmpf6PPRl3kJpN0G7XcMA,Bài hát hay! Mv gần gủi!,0
0Mr3CqCDq3o,2023-03-28 22:27:20,UCbQC-EVW5eYD-2H0xthbi3A,Mộc mạc từ cách ăn mặt cho đến đôi dép . Rất khác so vs hoài linh,0
0Mr3CqCDq3o,2023-03-28 22:48:48,UCxeDbNRVuik6-EuV7g4YG6w,"Nall hát hay nhất, Em rất thích",0
0Mr3CqCDq3o,2023-03-28 22:51:48,UCG-6vcppHAgKWp_AZarLZKw,nghe lần thứ N+N,0
0Mr3CqCDq3o,2023-03-28 23:16:37,UCRHbu0GgspW6m6euhRDEM_w,Vậy cái có vợ lun kkkk,0
0yHtYPeK2Jg,2023-03-28 00:39:02,UCAxlfm7nlsucpSyMaovZVcA,Tới hôm nay vẫn nghe,0
0yHtYPeK2Jg,2023-03-28 00:39:08,UCAxlfm7nlsucpSyMaovZVcA,Vẫn thấy hay,0
0yHtYPeK2Jg,2023-03-28 00:44:01,UCmlLtO6bxzRz2ZBmVnYMvQQ,"nhac cua Masew thi qua dinh roi , xuat sac luon em oi",0
0yHtYPeK2Jg,2023-03-28 01:20:09,UC5x1P16gEZXoZiAvTJOPq3g,hay,0
0yHtYPeK2Jg,2023-03-28 03:31:15,UCVHyr_d2-AG7Gi5_kOg-JhQ,cũng là mầu nhưng lạ lắm,0
0yHtYPeK2Jg,2023-03-28 03:44:04,UCP2CkvVWC_iip4qH3obkerQ,hay qua chi oi,0
0yHtYPeK2Jg,2023-03-28 03:50:14,UCuv-ql62SS6JOMU-50NTzZA,Hello chị,0
0yHtYPeK2Jg,2023-03-28 04:01:16,UCqwlGTzjNubVyRVkkB2aNWg,Hay quá,0
0yHtYPeK2Jg,2023-03-28 04:17:23,UCw4xD7TU5BAV8D9rFQokImw,3:30,0
0yHtYPeK2Jg,2023-03-28 04:22:20,UCLHU9iXbuK-zpVzWBcm1uJA,Hay quá chị iu,0
0yHtYPeK2Jg,2023-03-28 05:25:04,UCnvoRYxQn08iydATaWRjXrA,Hay quá k biết nói gì 🥰,0
0yHtYPeK2Jg,2023-03-28 05:42:31,UC4DJMYW24bBwtL_Pmi-Zn-g,hãy nhoa,0
0yHtYPeK2Jg,2023-03-28 05:44:58,UCwAv3lzeecKqUpGR8k4eRIw,Hay qua chi hoa oi😊😊😊😊😊😊😊😊😊😊😊😊😊😊😊😊😊😊😊😊😊😊😊😊😊😊😊😊😊😊😊😊😊😊😊😊😊😊😊😊😊😊😊😊😊😊😊😊😊😊😊😊😊😊😊😊😊😊😊😊😊😊😊😊😊😊😊😊😊😊😊😊😊😊😊😊😊😊😊😊😊😊😊😊😇,0
0yHtYPeK2Jg,2023-03-28 05:56:56,UCtL6CpPVS1qyZkUXw1Z_ZOw,Nhìn ảo quá :)),0
0yHtYPeK2Jg,2023-03-28 06:23:25,UCVNRQ9oCPVbqowoEcEwMkqg,"Chị Hòa hát chất giọng hay quá, a Masew làm nhạc đỉnh quá",0
0yHtYPeK2Jg,2023-03-28 06:28:50,UC_2nluoc7Aj7WXipYJd-6Wg,Bé nhà mình 4t cũng đam mê thị màu thuộc luôn 😂,0
0yHtYPeK2Jg,2023-03-28 06:48:05,UCBlhAL0xIiByhp8fOGo4Hyw,"Thích ca sĩ có Mv nổi bằng thực lực, Hoà ra MV đầu tư nhưng kg hề quảng cáo đã tiên tốn 5 tỉ, 10 tỉ gì cả. Hay tự động khán giả biết. Còn nhiều cs mắc cười ra cái Mv kg có cái gì hết mà rao trước là tốn tiền tỉ mắc mệt hát kg hay thì bao tỉ cũng kệ mấy người, mấy người mắc cười. Tôi like cho Hoà ❤",0
0yHtYPeK2Jg,2023-03-28 06:56:40,UC8QHt4oUNsb7gIehiBPywnw,gần 19tr views và vẫn chưa có dấu hiệu dừng lại,0
0yHtYPeK2Jg,2023-03-28 07:52:40,UC91Qq2mPfphTsoK-wFLp23Q,Hay quá H ơi 🎉 chúc mừng em ❤,0
0yHtYPeK2Jg,2023-03-28 08:45:38,UCmai4i-AHMQVDQLEJ8zN18Q,Hay quá. Xứng đáng top 1 trending ạ,0
0yHtYPeK2Jg,2023-03-28 09:10:08,UCf8ojrGN5xAdd0-LaxfWEmw,Có ai đến giờ vẫn nghiền bài này không :)),0
0yHtYPeK2Jg,2023-03-28 09:19:47,UCSDEWL_kbRdCXaLCdnNTrtw,"Rất thích xem MV của Hòa Minzy, rất tự nhiên mà xinh chứ :))",0
0yHtYPeK2Jg,2023-03-28 10:31:32,UCc7Xrt77906I5OVCWM8OoTg,Nhạc cũ giong hoàng thùy linh,0
0yHtYPeK2Jg,2023-03-28 11:01:08,UCmR9_QCAuVwq0UlGOBPQHtQ,Lyric: Tự xưng em là Thị Mầu Í là con gái phú ông Tuổi em chứ còn bé lắm Cũng chưa đến trăng rằm Ớ này chị em ơi Nay tư mai đã mười lăm Ai muốn đi ăn oản Thì lên chùa với em Á a i à ì a Á i a ì a Em lên chùa từ mười ba Á a i à ì a Á i a ì a Em lên chùa ngày mười lăm Này thầy tiểu ơi Em là Thị Mầu Em không biết đâu Em cứ bắt đền Gọi mẹ thưa cha Ăn vạ cả làng Cho em lấy chàng Tình tang tang tình tình tang Tự xưng em là Thị Mầu Í là con gái phú ông Tuổi em chứ còn bé lắm Cũng chưa đến trăng rằm Ớ này chị em ơi Nay tư mai đã mười lăm Ai muốn đi ăn oản Thì lên chùa với em Á a i à ì a Á i a ì a Em lên chùa từ mười ba nà Á a i à ì a Á i a ì a Em lên chùa ngày mười lăm Này thầy tiểu ơi Em là Thị Mầu Em không biết đâu Em cứ bắt đền Gọi mẹ thưa cha Ăn vạ cả làng Cho em lấy chàng Tình tang tang tình tình tang Tình tang tang tình tình tang Tình tang tang tình tình tang Tang tình tang tính tính tang Tình tang tang tình tang tính Bớ làng nước ơi Bớ làng nước ơi Này thầy tiểu ơi Em là Thị Mầu Em không biết đâu Em cứ bắt đền Gọi mẹ thưa cha Ăn vạ cả làng Cho em lấy chàng Tình tang tang tình tình tang,0
0yHtYPeK2Jg,2023-03-28 11:16:26,UC2ZeUFZB3Gakr-Qgvvg0aIg,.,0
0yHtYPeK2Jg,2023-03-28 11:27:05,UCwVJjAq9wt5U1UmeayN9hFw,Nghe bài này hay quá. Hòa minzy đã gửi thông điệp gì mình không rõ lắm nhưng cảm nhận sự xót xa cho nhân vật thị mầu này quá. Từ tác phẩm văn học mà cũng rất đời. Nhưng cảm nhận rất thương bạn này. Mong bạn luôn cảm nhận được tình yêu bạn tìm kiếm.,0
0yHtYPeK2Jg,2023-03-28 12:18:15,UCnCPUOwNqy7gqsc_gnxncZA,Xem đi xem lại không chấn luôn ❤,0
0yHtYPeK2Jg,2023-03-28 12:36:35,UCxEmK2yxs1x3MzwAWWZkJDA,Tự xưng em là Thị Mầu Í là con gái phú ông Tuổi em chứ còn bé lắm Cũng chưa đến trăng rằm Ớ này chị em ơi Nay tư mai đã mười lăm Ai muốn đi ăn oản Thì lên chùa với em Á a i à ì a Á i a ì a Em lên chùa từ mười ba Á a i à ì a Á i a ì a Em lên chùa ngày mười lăm Này thầy tiểu ơi Em là Thị Mầu Em không biết đâu Em cứ bắt đền Gọi mẹ thưa cha Ăn vạ cả làng Cho em lấy chàng Tình tang tang tình tình tang Tự xưng em là Thị Mầu Í là con gái phú ông Tuổi em chứ còn bé lắm Cũng chưa đến trăng rằm Ớ này chị em ơi Nay tư mai đã mười lăm Ai muốn đi ăn oản Thì lên chùa với em Á a i à ì a Á i a ì a Em lên chùa từ mười ba nà Á a i à ì a Á i a ì a Em lên chùa ngày mười lăm Này thầy tiểu ơi Em là Thị Mầu Em không biết đâu Em cứ bắt đền Gọi mẹ thưa cha Ăn vạ cả làng Cho em lấy chàng Tình tang tang tình tình tang Tình tang tang tình tình tang Tình tang tang tình tình tang Tang tình tang tính tính tang Tình tang tang tình tang tính Bớ làng nước ơi Bớ làng nước ơi Này thầy tiểu ơi Em là Thị Mầu Em không biết đâu Em cứ bắt đền Gọi mẹ thưa cha Ăn vạ cả làng Cho em lấy chàng Tình tang tang tình tình tang,0
0yHtYPeK2Jg,2023-03-28 12:52:27,UChbIMIAEA2V6MXMkN-bpqfg,Như con ngây,0
0yHtYPeK2Jg,2023-03-28 13:11:50,UC4hSHCYO4vDBf-9tAeY6H_g,hay quá em ak,0
0yHtYPeK2Jg,2023-03-28 13:28:22,UCbt0WT-RHlcvBT-K8Vd1Nlw,Quá đỉnh rồi.,0
0yHtYPeK2Jg,2023-03-28 13:35:34,UC_abUqt10H_T8L_BEbwYsnA,hay qué chị ưi,0
0yHtYPeK2Jg,2023-03-28 13:35:35,UCwq-VqExDahkhbGNQwL6ipQ,❤❤,0
0yHtYPeK2Jg,2023-03-28 13:55:28,UCRbltwEphB2CzN4YquLx7Pg,Tự xưng em là Thị Mầu  Í là con gái phú ông  Tuổi em chứ còn bé lắm  Cũng chưa đến trăng rằm  Ớ này chị em ơi  Nay tư mai đã mười lăm  Ai muốn đi ăn oản  Thì lên chùa với em  Á a i à ì a  Á i a ì a  Em lên chùa từ mười ba  Á a i à ì a  Á i a ì a  Em lên chùa ngày mười lăm  Này thầy tiểu ơi  Em là Thị Mầu  Em không biết đâu  Em cứ bắt đền  Gọi mẹ thưa cha  Ăn vạ cả làng  Cho em lấy chàng  Tình tang tang tình tình tang  Tự xưng em là Thị Mầu  Í là con gái phú ông  Tuổi em chứ còn bé lắm  Cũng chưa đến trăng rằm  Ớ này chị em ơi  Nay tư mai đã mười lăm  Ai muốn đi ăn oản  Thì lên chùa với em  Á a i à ì a  Á i a ì a  Em lên chùa từ mười ba nà  Á a i à ì a  Á i a ì a  Em lên chùa ngày mười lăm  Này thầy tiểu ơi  Em là Thị Mầu  Em không biết đâu  Em cứ bắt đền  Gọi mẹ thưa cha  Ăn vạ cả làng  Cho em lấy chàng  Tình tang tang tình tình tang  Tình tang tang tình tình tang  Tình tang tang tình tình tang  Tang tình tang tính tính tang  Tình tang tang tình tang tính  Bớ làng nước ơi  Bớ làng nước ơi  Này thầy tiểu ơi  Em là Thị Mầu  Em không biết đâu  Em cứ bắt đền  Gọi mẹ thưa cha  Ăn vạ cả làng  Cho em lấy chàng  Tình tang tang tình tình tang,0
0yHtYPeK2Jg,2023-03-28 13:56:32,UC422H4bcyqv6UQ21vnyvN0A,Chiềng làng chiềng chạ Thượng hạ Tây Đông Con gái Phú Ông tên là Mầu Thị Tư tình ngoại ý Mãn nguyệt có … Mời già trẻ gái trai Ra đình mà ăn khoán…í a..  Tự xưng em là Thị Mầu Ý là con gái Phú Ông Tuổi em chứ còn bé lắm Cũng chưa đến trăng rằm Ơ này chị em ơi Nay tư mới đã mười lăm Ai muốn đi ăn oản Thì lên Chùa với em Ớ ơi à ời à ời à ời a Em lên Chùa từ mười ba Ớ ơi à ời à ời à ời a Em lên Chùa ngày mười lăm Này Thầy Tiểu ơi Em là Thị Mầu Em không biết đâu Em cứ bắt đền Gọi Mẹ thưa Cha Ăn vạ cả làng Cho Em lấy Chàng Tình tang tang tình tình tang,0
0yHtYPeK2Jg,2023-03-28 14:36:20,UCRGBamSEo4j3LsNUY2s1CYQ,Tự xưng em là Thị Mầu Í là con gái phú ông Tuổi em chứ còn bé lắm Cũng chưa đến trăng rằm Ớ này chị em ơi Nay tư mai đã mười lăm Ai muốn đi ăn oản Thì lên chùa với em Á a i à ì a Á i a ì a Em lên chùa từ mười ba Á a i à ì a Á i a ì a Em lên chùa ngày mười lăm Này thầy tiểu ơi Em là Thị Mầu Em không biết đâu Em cứ bắt đền Gọi mẹ thưa cha Ăn vạ cả làng Cho em lấy chàng Tình tang tang tình tình tang Tự xưng em là Thị Mầu Í là con gái phú ông Tuổi em chứ còn bé lắm Cũng chưa đến trăng rằm Ớ này chị em ơi Nay tư mai đã mười lăm Ai muốn đi ăn oản Thì lên chùa với em Á a i à ì a Á i a ì a Em lên chùa từ mười ba nà Á a i à ì a Á i a ì a Em lên chùa ngày mười lăm Này thầy tiểu ơi Em là Thị Mầu Em không biết đâu Em cứ bắt đền Gọi mẹ thưa cha Ăn vạ cả làng Cho em lấy chàng Tình tang tang tình tình tang Tình tang tang tình tình tang Tình tang tang tình tình tang Tang tình tang tính tính tang Tình tang tang tình tang tính Bớ làng nước ơi Bớ làng nước ơi Này thầy tiểu ơi Em là Thị Mầu Em không biết đâu Em cứ bắt đền Gọi mẹ thưa cha Ăn vạ cả làng Cho em lấy chàng Tình tang tang tình tình tang,0
0yHtYPeK2Jg,2023-03-28 14:39:50,UCkG73scFdloI0E3y6XiQW0g,Vãi cả tôi làm bánh khúc đây 🤣,0
0yHtYPeK2Jg,2023-03-28 14:55:10,UCpzVxK39OnLnyT9-hsyh2eg,Tự xưng em là Thị Mầu Í là con gái phú ông Tuổi em chứ còn bé lắm Cũng chưa đến trăng rằm Ớ này chị em ơi Nay tư mai đã mười lăm Ai muốn đi ăn oản Thì lên chùa với em Á a i à ì a Á i a ì a Em lên chùa từ mười ba Á a i à ì a Á i a ì a Em lên chùa ngày mười lăm Này thầy tiểu ơi Em là Thị Mầu Em không biết đâu Em cứ bắt đền Gọi mẹ thưa cha Ăn vạ cả làng Cho em lấy chàng Tình tang tang tình tình tang Tự xưng em là Thị Mầu Í là con gái phú ông Tuổi em chứ còn bé lắm Cũng chưa đến trăng rằm Ớ này chị em ơi Nay tư mai đã mười lăm Ai muốn đi ăn oản Thì lên chùa với em Á a i à ì a Á i a ì a Em lên chùa từ mười ba nà Á a i à ì a Á i a ì a Em lên chùa ngày mười lăm Này thầy tiểu ơi Em là Thị Mầu Em không biết đâu Em cứ bắt đền Gọi mẹ thưa cha Ăn vạ cả làng Cho em lấy chàng Tình tang tang tình tình tang Tình tang tang tình tình tang Tình tang tang tình tình tang Tang tình tang tính tính tang Tình tang tang tình tang tính Bớ làng nước ơi Bớ làng nước ơi Này thầy tiểu ơi Em là Thị Mầu Em không biết đâu Em cứ bắt đền Gọi mẹ thưa cha Ăn vạ cả làng Cho em lấy chàng Tình tang tang tình tình tang,0
0yHtYPeK2Jg,2023-03-28 15:35:49,UCbnSPx788sajPqIiVUDNdkA,So great.,0
0yHtYPeK2Jg,2023-03-28 16:02:49,UCuIna_YFGNZNy2EwkonSsLQ,Bạn thiếu mười tư và sai tình tang tang tình tình tang (HTL đã đúng ... tình tang  trước rồi),0
0yHtYPeK2Jg,2023-03-28 16:40:04,UCrvVlm6jv6LZ-iVHxySVEjA,"Quá hay,quá xuất sắc",0
0yHtYPeK2Jg,2023-03-28 17:08:09,UCUJCllSuWki2dH0Fmdc0eHQ,"Thực sự rất thích trang phục Hòa mặc trong MV. Vừa sáng tạo, vừa k mất nét truyền thống. Quá đẹp.",0
0yHtYPeK2Jg,2023-03-28 17:13:24,UCT4tsCS8RBmXqA1no6FgODg,Xem BLHV c Hòa chia sẻ mà thấy thương 😢 ráng giữ top nha mn❤,0
0yHtYPeK2Jg,2023-03-28 21:46:33,UCaGpD6J9Ml6W_gUiSR6m3vw,"Nghe bàn tán mãi,hôm nay sực nhớ tìm nghe cho bằng được xem sao mặc dù cũng chưa khi nào nghe Hoà hát. Hay quá cô bé ơi! Chúc con và bạn nhỏ luôn bình an,vui vẻ con gái nhé 💐🍭💗.",0
0yHtYPeK2Jg,2023-03-28 21:59:16,UC_p3Loqi2xIGvnFhAfi_6lg,"Ngày nào cũng vào xem MV .Hoà Minzy một cô gái đa tài , xinh đẹp.",0
4qNALNWoGmI,2023-03-28 03:03:37,UCv5F89AGbaXVcDyHzXaq61A,Hát xàm xàm vậy mà cũng thành trend :v,0
4qNALNWoGmI,2023-03-28 04:17:41,UCltXs6JYvIAGFr_30gRY2Hw,meo meo meo meo,0
4qNALNWoGmI,2023-03-28 04:39:05,UC0aU1iveOvzzzP8vdN3lHZA,"Bài hát cute quá, đặc biệt là đối với những người yêu mèo như tôi, kết hợp giọng hát nữ tính, ngọt ngào. RẤT TUYỆT VỜI 👍💯💯💯😍😍😍",0
4qNALNWoGmI,2023-03-28 04:46:41,UCLaagoi1MgO1vT2-nA3artg,điếc đít quá tha bố,0
4qNALNWoGmI,2023-03-28 06:12:57,UCYuxZo3f-aaAvSOsc00OaKg,meo meo meo,0
4qNALNWoGmI,2023-03-28 06:17:35,UCnn4mwxA597DsrLYIrzi8Ig,Test game và nhiệt đi khôi. Mình cũng qtam mà k biết nếu kết nối chuột wiriles và sạccùng,0
4qNALNWoGmI,2023-03-28 07:09:47,UCrXVAsu3MsK1so4vrnL98uA,Tắt đèn đi  =)))),0
4qNALNWoGmI,2023-03-28 07:22:57,UCz374E-JgjD_4SmYmpkjEcw,djt con me thề nhớt vãi lozzz,0
4qNALNWoGmI,2023-03-28 07:41:30,UCYAHq-8hGkW3FV7fX49pUQg,"Ai sáng tác bài này ta, cuốn thực sự. Rất đáng yêu",0
4qNALNWoGmI,2023-03-28 08:06:19,UC9djHuconjXjzDI1MucGl2g,Ám ảnh vkh,0
4qNALNWoGmI,2023-03-28 08:34:50,UC_X-1H_qd1cPd1g8x5D1rhw,Pp,0
4qNALNWoGmI,2023-03-28 08:34:56,UCRWqMuXsbWqXI-o_2r0ccrQ,em rất xuất tôi đã xinh,0
4qNALNWoGmI,2023-03-28 08:59:45,UCQootEwNlrZE5I_90VSGbQQ,Bài chán ghê,0
4qNALNWoGmI,2023-03-28 08:59:54,UCQootEwNlrZE5I_90VSGbQQ,Cho 0 sao,0
4qNALNWoGmI,2023-03-28 09:36:34,UCx8KxIAMKPqdzHWotsbIQ4Q,"Cho hỏi là *Tắt Đèn Đi* hay *Bắt Đền Đi* vậy , hoang mang thực sự 😂😂",0
4qNALNWoGmI,2023-03-28 09:43:25,UCFCJXuYBygkAW1aHMUzVVag,meo meo meo meo,0
4qNALNWoGmI,2023-03-28 10:46:19,UCijNAukrqhaQ1hkVN26A_4g,0:27 đây chính là nơi mà tôi bị lũ bạn tra tấn trong suốt 1 tuần qua,0
4qNALNWoGmI,2023-03-28 11:02:24,UCN3siIgmhUldekc4lZMOSaA,Một cách thần kỳ nào bài này nó lại lưu lại trong đầu tui mặc dù tui chưa chủ động nghe nó lần nào@@ F..k! this song is stuck in my head,0
4qNALNWoGmI,2023-03-28 11:50:12,UCpRHS0DsXi3HgTRuMZ-V9oA,Bố m xin đấy nghe ám ảnh vlin,0
4qNALNWoGmI,2023-03-28 12:43:18,UCio70pb520k55VWz8gic4HA,l love this song❤❤❤❤,0
4qNALNWoGmI,2023-03-28 12:52:05,UCZi69VmNycejApMkJo004CQ,đừng để chị Mỹ Diệu nghe đc bài này chị đã xâm chiếm mạng xã hội hơn 1 tháng và giờ có hẳng 1 bài dành cho chị nói chung :)))),0
4qNALNWoGmI,2023-03-28 12:53:27,UCVEWxf4ua31bn9--lVwJfhQ,CENA đã đưa tui tới đây,0
4qNALNWoGmI,2023-03-28 13:27:26,UCexgzsGByRcY4Sr5mB-inuQ,hát live dở mà còn dẹo nữa mà cứ ra bài quài,0
4qNALNWoGmI,2023-03-28 13:34:59,UCcYUq8km-Bqi4Ffht7_5wDw,"bạn này đang hát tiếng việt ấy hả, nghe ra được chữ ngoài meo meo vậy",0
4qNALNWoGmI,2023-03-28 14:22:03,UCXHziuWqz9G8VsskgXU8NIQ,Hay 💯 😂,0
4qNALNWoGmI,2023-03-28 14:24:22,UClSGlhFfzEcqm5hfL2q-N0g,meowmeow,0
4qNALNWoGmI,2023-03-28 14:33:29,UCEYic7srDb0UIBAokJ5ye1w,"Tất cả tại anh Sa Béo mà tôi nghiện bài này, Ciao Ăng vl =))))",0
4qNALNWoGmI,2023-03-28 15:09:44,UCwJ7Pms6LJ3I7YRnQjn1c6A,베트남도 음악이 상당히 좋네요. 이정도라니..wow,0
4qNALNWoGmI,2023-03-28 15:50:26,UCLkWUu5xvGHlL7BBQXeMzSA,Nghe mất đền ik thành tắt đền ik,0
4qNALNWoGmI,2023-03-28 16:04:47,UCCfT61I4i9sg0bibJ-N5J4Q,new jeans ?,0
4qNALNWoGmI,2023-03-28 16:26:31,UCmai4i-AHMQVDQLEJ8zN18Q,Giai điệu này đáng yêu quá,0
4qNALNWoGmI,2023-03-28 16:55:00,UCFg6So0lVHVQOxUUUUi6TDg,cái ông viết ra bài này có được gọi là nhạc sĩ không,0
4qNALNWoGmI,2023-03-28 17:46:18,UC2h0hMQVjRo_hcULf8yo32Q,tuy hát không nghe được con mẹ gì mà thấy cưng,0
4qNALNWoGmI,2023-03-28 18:14:13,UCVSWxrzuaoM2nkDYF0cJrjQ,nghe như nhạc sổ số gì đấy lâu rồi =))),0
4qNALNWoGmI,2023-03-28 19:33:07,UCKiyHPuQeP8LbHF00SFcaZQ,Bài nghe cuốn qá cơ mà thấy bóng dáng newjeans ở đây :)) vì củng thích newjeans :))),0
4qNALNWoGmI,2023-03-28 23:46:50,UC6ZGnOWXGqdvF64ZCoIjMBg,cí lùm mía bài vậy mà cũng sáng tác ra được hay thiệt,0
DC842pmeamA,2023-03-28 01:33:00,UCmsJJomI9HRu9d6YIoVPxxQ,.❤️,0
DC842pmeamA,2023-03-28 02:52:21,UCWVnyW-4BbuBkevIj08y1DA,hay,0
DC842pmeamA,2023-03-28 04:32:51,UCHmaajRY7hp58tC_wMLboIA,"Mê bài này quá, nghr hoài k chán <33",0
DC842pmeamA,2023-03-28 04:33:02,UCr__OZJZtMLi-_5iDsAVW1Q,bài này chill ghê,0
DC842pmeamA,2023-03-28 06:14:02,UCF8vXvtUNZUrzS7ND08LUyQ,lyrics nha: Gió nhẹ sang tôi ngỡ trời xuân   Nắng hồng lên tôi ngỡ đông tàn   Ai có ngờ đâu đông vẫn còn đây   Xuân chưa về   Tôi ngỡ tình ta xanh ngát trời xuân   Đâu biết ngày đông kéo đến bất chợt   Yêu mấy rồi nay cũng hóa tàn phai   Theo người  Gió mang hương về giờ em ở đâu vương trên môi nụ hôn của ai   Để bây giờ tình ta sẽ không bền lâu được thêm nữa đâu   Xin em hãy cứ đi đi thật xa đừng về đây níu kéo những thứ vốn không thuộc về 1 người vô tâm   Có hay đâu em chỉ xem tình tôi như mây trôi lạc giữa trời kia   Chén men sầu làm sao vơi đi niềm đau mà em đã trao   Bao câu hẹn ước ta bên cạnh nhau vội quên mau thương đau cạnh tôi bởi em đi rồi!!! ngồi với đơn côi   Mà vì lòng thương lắm ngậm ngùi   Mình tôi gánh phiền lo   Thương chẳng thể buông   Em có đâu ngờ   Trên khóe miệng cười tôi khóc trong tim   Em ở cạnh người môi mắt em vui   Thôi chắc đành vậy cạnh tôi thấy em buồn   Tôi chẳng đành lòng nhìn đôi mắt em sầu   Thương lắm rồi giờ đành buông để người đi…..   Tôi sầuu,0
DC842pmeamA,2023-03-28 06:31:50,UCHbOBK6oJqmJ5eEaPHYghMQ,hay,0
DC842pmeamA,2023-03-28 07:54:33,UCeeFdN_aO9ARhP5peWlDvoA,bb,0
DC842pmeamA,2023-03-28 09:12:26,UCkb8I0Hx__stU_YQAZs_n9A,Lắm view vãi :v,0
DC842pmeamA,2023-03-28 09:27:48,UCDUOnR1U_TtMj8bArSgFK1w,💋❤️❤️,0
DC842pmeamA,2023-03-28 09:32:11,UC3Qu_zXykj0D2LB86w0Q2Tg,:),0
DC842pmeamA,2023-03-28 09:51:03,UC0cvBoKRvLE9PHex4bx_rEA,hay,0
DC842pmeamA,2023-03-28 10:32:06,UCkb8I0Hx__stU_YQAZs_n9A,Bài hát hay quá,0
DC842pmeamA,2023-03-28 11:17:20,UCtCvgnrxGCaSUAuy7nZoUyw,Hay quó❤❤,0
DC842pmeamA,2023-03-28 12:37:44,UCZhQfZLysLlYU2ZsYDvYG0Q,lofell,0
DC842pmeamA,2023-03-28 12:45:24,UCE3UifynjKHFCbMSQ7Ahorg,Chúc mừng ad cán mốc 2M view,0
DC842pmeamA,2023-03-28 12:45:44,UCmeTszvB9xP-g0IBgjagDvQ,Chill,0
DC842pmeamA,2023-03-28 13:04:05,UCHJ2p8_FARMf8peFE9QvDLA,hay,0
DC842pmeamA,2023-03-28 13:19:42,UCH0_ni4Qxgu8b2J71bXxbfg,Bài hát này có giai điệu thật cô đơn 😞😞😞,0
DC842pmeamA,2023-03-28 13:50:44,UCsSHas7tzBF7_I82bzSd9sw,Nhạc vừa chill vừa cuốn nx,0
DC842pmeamA,2023-03-28 14:18:37,UCmai4i-AHMQVDQLEJ8zN18Q,Nhiều view hơn cả MV gốc rồi,0
DC842pmeamA,2023-03-28 14:45:33,UCj8iKeiLMc3Uh-kjoZvMvrA,bài hay vaiz :0 ...,0
DC842pmeamA,2023-03-28 16:22:09,UC5ZVUqjAAFuWEqSESoWOh5Q,Nhẹ nhàng mà hay thực sự 😍😍,0
DC842pmeamA,2023-03-28 16:26:19,UC8yXlubPw6j1nsZKbQHjEmQ,vừa vệ sinh giày vừa nghe bài này đã quá,0
DC842pmeamA,2023-03-28 16:33:09,UCFl00SoPI07s6wLzLAYwiJQ,Hay,0
