videoId,updateAt,authorId,cmt,label
N0VOGhhDWpc,2022-10-10 04:17:06,UC1KWv-GKTLIse1OzyJBEWBA,Yêu Nhân toàn tập !,1
N0VOGhhDWpc,2022-10-10 06:37:39,UCwmPEAIN51b3-KUZDFPl02A,Mình cảm đc bài này nhờ Nhân. Thanks bạn,0
N0VOGhhDWpc,2022-10-10 08:17:23,UCvD1WfwOOdXMBSJ2uSldI7Q,Giojng hát của Trúc Nhân đỉnh của đỉnh,2
N0VOGhhDWpc,2022-10-10 14:35:39,UCo4aFhdaqAYsI8cAASMTBDA,muốn nghe trúc nhân hát bài đôi giày vải quá,2
N0VOGhhDWpc,2022-10-10 20:54:11,UCQifLluI2hH0oHwtI9dGDfg,Truc nhan thoi tam hon vao bai hat nay nghe hay hon My Tam theo cam nhan cua rieng minh. Khong phai ai noi tieng la co the hat bai nao cung hay.,0
