videoId,updateAt,authorId,cmt,label
0yHtYPeK2Jg,2023-03-21 05:19:53,UCJ2LoZhSMep6ktzoOo1J1Kg,"Tôi không đồng tình được đây là 1 MV bảo vệ chính nghĩa, tạo động lực hay chiêu trò vớ vẩn của giới Nghệ Sĩ xúc phạm đến sức khỏe, quyền riêng tư đời sống của  1 cá nhân. Chắc nếu con cái nhà người ta chết thì tội ác của các người đền được không. Giới Nghệ Sĩ Ca Sĩ gì Bẩn Thỉu thế. Có xứng đáng đúng với những cái tên Mỹ Miều. Hạ nhục 1 cá nhân khi người ta đang chập chững từ cõi Chết trở về",0
0yHtYPeK2Jg,2023-03-21 05:23:19,UCJ2LoZhSMep6ktzoOo1J1Kg,"Đây là 1 MV ca nhạc của 1 giới Nghệ sĩ ca sĩ bẩn. Đụng chạm đến cuộc sống riêng tư, tín ngưỡng Tôn Giáo nhằm hạ nhục bôi nhọ danh dự cá nhân",0
0yHtYPeK2Jg,2023-03-21 05:26:49,UCJ2LoZhSMep6ktzoOo1J1Kg,"Có Trời PHật, bề trên đó các người làm thế này không được đâu",0
0yHtYPeK2Jg,2023-03-21 05:27:11,UCkznXJqv8FubDfOEn3Diwmg,Hay  quá múng siểu,0
0yHtYPeK2Jg,2023-03-21 05:34:15,UCJ2LoZhSMep6ktzoOo1J1Kg,MV Ngu Ác thì đúng hơn Thị Mầu gì Hòa Minzy,0
0yHtYPeK2Jg,2023-03-21 05:34:45,UCJ2LoZhSMep6ktzoOo1J1Kg,Có gì gặp Tôi ở Pháp Luật nước nhà Việt Nam,0
0yHtYPeK2Jg,2023-03-21 05:41:37,UCPVM2Maac0Spc6t4muVD-CA,Ôi giọng cười😂😂ha ha🎉,0
0yHtYPeK2Jg,2023-03-21 05:53:03,UCfWTruFN9BpdJokOysQAziA,Omg đỉnh(｡☬０☬｡),0
0yHtYPeK2Jg,2023-03-21 06:04:33,UCuai_PQRv4e7pUZn8X7sSDA,Cô thu huyền là người diễn thị màu hay nhất,0
0yHtYPeK2Jg,2023-03-21 06:25:49,UC7nbKr24gG--4erPu6QXd4A,hihihi,0
0yHtYPeK2Jg,2023-03-21 06:30:32,UCJ2LoZhSMep6ktzoOo1J1Kg,"1 MV ca nhạc Ngu Ác. Châm biếm, mỉa mai, hạ nhục và hạ bệ. Tất cả đều có trên Google vào đời sống cá nhân của  1 con người",0
0yHtYPeK2Jg,2023-03-21 06:44:13,UCVFKF4TZlz5DoXa5O5BXSrQ,Càng nghe càng thấy cuốn,0
0yHtYPeK2Jg,2023-03-21 06:57:18,UCvgUnlBpfeQuzO4bxNZp8UQ,Bộ đồ và nước từ đâu ra vậy bé.....,0
0yHtYPeK2Jg,2023-03-21 07:05:47,UC2vik6ce0vAJXNF6-uvZZcQ,"Even though I can't understand it, I like it❤️ From Philippines 🇵🇭❤",0
0yHtYPeK2Jg,2023-03-21 07:23:32,UCj8PUUsmLqc5T0PSoBqQcbQ,ôi hãy quá,0
0yHtYPeK2Jg,2023-03-21 07:27:40,UCgawLuo4scv8Z2-R4E3kiFg,10điểm,0
0yHtYPeK2Jg,2023-03-21 08:46:45,UCl41f4fd-60GvdW-1-925eg,Hay,0
0yHtYPeK2Jg,2023-03-21 08:48:14,UC-f1bz5yvtC_LcDRfbPzQzA,video nhìn bắt mắt vl,0
0yHtYPeK2Jg,2023-03-21 08:50:15,UCGoF6U8N93qtPxyomiLlmzQ,Top 1 music rồi,0
0yHtYPeK2Jg,2023-03-21 09:41:16,UC_b2fHzejrbmh6S15nFRqVw,"HAU QUÁ MẦU ƠI, KHI NÀO VỀ QUẾ VÕ GẶP NHÉ",0
0yHtYPeK2Jg,2023-03-21 09:42:43,UCDdoG8EYyDzHeer8iqctulA,Hay quá 👏 👍,0
0yHtYPeK2Jg,2023-03-21 09:46:49,UCTRfJuN9sgPekqVTCO220nQ,Chúc mừng hòa nhé,0
0yHtYPeK2Jg,2023-03-21 10:23:49,UCNqGwInSwljTaENFtjsMenQ,hay quá❤,0
0yHtYPeK2Jg,2023-03-21 10:24:55,UCN0mh8PaDuNimOGA-jwj5Dg,Hay như cá voi sát sụ❤❤❤❤❤😂,0
0yHtYPeK2Jg,2023-03-21 10:28:28,UCUDKPGWRvsJCTOAsafFzyNA,Hay quá,0
0yHtYPeK2Jg,2023-03-21 10:49:02,UCeZlz36CBhsmyYMGec_Rfow,Có bầu nhưng lạ lắm :)),0
0yHtYPeK2Jg,2023-03-21 10:53:44,UCkcVHrUN2rbPXcLT0kCMnug,1:49 hay thiệt đó,0
0yHtYPeK2Jg,2023-03-21 10:54:01,UCjbBDC2nuTTWFX-mjVGMRJg,Chém cha cái con thị mầu đêm nằm lồn ngứa nó nằm với thằng nô lè vày,0
0yHtYPeK2Jg,2023-03-21 10:59:35,UCFnznC_lgLJe_IQjRSSrNRQ,Nghe đi nghe lại 10 lần 1 ngày,0
0yHtYPeK2Jg,2023-03-21 11:15:02,UCoWHzSr91GvLj7POmlpXwFA,"View hơn cả sơn tùng luôn, đỉnh quá😂😂😂",0
0yHtYPeK2Jg,2023-03-21 11:27:05,UC0-UB1wqs-VHXhYighRRoTw,Hay quá ạ<3333🫶🏻💕,0
0yHtYPeK2Jg,2023-03-21 11:27:37,UCyszbqKD-iBjya9mu32-xmw,Ăq5⁰❤5 😂 wprkp⁹,0
0yHtYPeK2Jg,2023-03-21 11:35:38,UCpQ77u3OEhd50jXpjPkoRTQ,Hay,0
0yHtYPeK2Jg,2023-03-21 11:35:46,UCpQ77u3OEhd50jXpjPkoRTQ,Con qi nghe k,0
0yHtYPeK2Jg,2023-03-21 11:44:40,UCSeIgd4UxluC3VNue39Bprg,Có vài khúc ko ổn lắm nhưng hay lắm luôn ắ🕊,0
0yHtYPeK2Jg,2023-03-21 12:02:05,UCSDjAyeJXEeYChfozhow2Gw,Sẽ đưa Chị hòa lên đỉnh...❤❤😂,0
0yHtYPeK2Jg,2023-03-21 12:02:34,UC1SdFPU3biiPQR09gPF3Rwg,😊,0
0yHtYPeK2Jg,2023-03-21 12:06:15,UCztRL2_rWchh511Aks2ybNw,hay,0
0yHtYPeK2Jg,2023-03-21 12:07:21,UCB_ZWLrUwOuVSVcopI3GCeQ,Top 1 rồi bà,0
0yHtYPeK2Jg,2023-03-21 12:12:15,UCIJZS3SU5V4pRN4NErMDEeQ,Sao tui nghe là Thị Bầu ko nhờ có ai nghe giống tui ko ta=)))),0
0yHtYPeK2Jg,2023-03-21 12:31:58,UCJ2LoZhSMep6ktzoOo1J1Kg,Tôi có đủ Chứng Cứ để đưa các người ra Pháp Luật,0
0yHtYPeK2Jg,2023-03-21 12:43:54,UCibTVeV0xOi6jPfzhegDkIw,1. Lời bài hát Thị Mầu - Hòa Minzy ft Masew  Chiềng làng chiềng chạ  Thượng hạ Tây Đông  Con gái Phú Ông tên là Mầu Thị  Tư tình ngoại ý  Mãn nguyệt có …  Mời già trẻ gái trai  Ra đình mà ăn khoán…í a..    Tự xưng em là Thị Mầu  Ý là con gái Phú Ông  Tuổi em chứ còn bé lắm  Cũng chưa đến trăng rằm  Ơ này chị em ơi  Nay tư mới đã mười lăm  Ai muốn đi ăn oản  Thì lên Chùa với em  Ớ ơi à ời à ời à ời a  Em lên Chùa từ mười ba  Ớ ơi à ời à ời à ời a  Em lên Chùa ngày mười lăm  Này Thầy Tiểu ơi  Em là Thị Mầu  Em không biết đâu  Em cứ bắt đền  Gọi Mẹ thưa Cha  Ăn vạ cả làng  Cho Em lấy Chàng  Tình tang tang tình tình tang    Bớ làng nước ơi....    2. Này thầy tiểu ơi em là Thị Mầu    3. Hợp âm Thị Mầu  Tự xưng em là Thị [Am] Mầu  Í là con gái phú [Em] ông  Tuổi em chứ còn bé [F] lắm  Cũng chưa đến trăng [Dm] rằm.    Ớ này chị em [Am] ơi  Nay tư mai đã mười [Em] lăm  Ai muốn đi ăn [F] oản  Thì lên chùa với [Dm] em.    [Am] Á a i à ì [Em] a  Á i a ì [F] a  Em lên chùa từ mười [Dm] ba  [Am] Á a i à ì [Em] a  Á i a ì [F] a  Em lên chùa ngày mười [Dm] lăm.    Này thầy tiểu [Am] ơi  Em là Thị [Em] Mầu  Em không biết [F] đâu  Em cứ bắt [Dm] đền.    Gọi mẹ thưa [Am] cha  Ăn vạ cả [Em] làng  Cho em lấy [F] chàng  Tình tang tang tình tình [Am] tang.,0
0yHtYPeK2Jg,2023-03-21 12:44:44,UCJ2LoZhSMep6ktzoOo1J1Kg,Các người là Ca Sĩ Nghệ Sĩ có danh xưng Mĩ Miều nhưng không có Nhân Đức và Lương Tâm . Nhân Văn không cặn kẽ,0
0yHtYPeK2Jg,2023-03-21 12:49:35,UCuai_PQRv4e7pUZn8X7sSDA,Quá tuyệt vời với MV này,0
0yHtYPeK2Jg,2023-03-21 12:57:41,UCwNASpKmsrlt_NTYeap9cXw,hồng nhan bạc phận,0
0yHtYPeK2Jg,2023-03-21 13:05:57,UCHP2CmMz_wwkomy2XG1R_Gw,f q,0
0yHtYPeK2Jg,2023-03-21 13:07:27,UCf7huxtjxeW-69dpKF-_EbA,ỏ chj xink quó,0
0yHtYPeK2Jg,2023-03-21 13:17:37,UCE0l7EM57_tOXbGQDN4pzHA,Hòa ơi . thích video này thật,0
0yHtYPeK2Jg,2023-03-21 13:25:33,UCA6Ulqfw2-qR4GY1n-l-4xg,Hay lắm chị Hòa của em❤,0
0yHtYPeK2Jg,2023-03-21 13:36:31,UCbt0WT-RHlcvBT-K8Vd1Nlw,Quá hay luôn.,0
0yHtYPeK2Jg,2023-03-21 13:38:57,UCWMMniR1-4WcKrxUDnsfSEA,..,0
0yHtYPeK2Jg,2023-03-21 13:55:55,UC5YeNT2q9BH2mvNNZS_DQDQ,Từ tôi fan nhạc Ai kìa bóng sáng ai rồi đến bài thị mầu,0
0yHtYPeK2Jg,2023-03-21 14:03:05,UCeCwZb41UyUnmo_-ak_Br2g,Nhạc này như phiêu rồi còn gì - Khác cái: ngắt hơi lâu Hehe,0
0yHtYPeK2Jg,2023-03-21 14:14:50,UCzgma9p77Z5uzSrFiA5PyyQ,.,0
0yHtYPeK2Jg,2023-03-21 14:26:48,UC8v0Ps77JdFnQslwvwfij5g,Eo ơi hay ko bt nói j luôn,0
0yHtYPeK2Jg,2023-03-21 14:35:15,UCLy2s9GkQOYWGGcoKYr9nAQ,Hay quá ạ,0
0yHtYPeK2Jg,2023-03-21 15:31:14,UCVoufj4kIy8OqfumjoTUEaA,Tuyệt,0
0yHtYPeK2Jg,2023-03-21 15:45:41,UC8vxINVpPC8n8urdViW0K3A,Mình không hiểu thị mầu đâu phải nhân vật hay ho gì mà viết thành bài hát nhỉ😮,0
0yHtYPeK2Jg,2023-03-21 15:57:45,UC_p3Loqi2xIGvnFhAfi_6lg,MV hay lắm,0
0yHtYPeK2Jg,2023-03-21 16:03:21,UCzDwrQAc5hD41QP2CjmDULg,😊😊,0
0yHtYPeK2Jg,2023-03-21 16:31:48,UCdGsKWsEw-9XuW4i993E8dg,❤❤❤,0
0yHtYPeK2Jg,2023-03-21 16:34:01,UC9P-o5NF43aJbiAid7sbdpg,HAY QUÁ,0
0yHtYPeK2Jg,2023-03-21 16:43:49,UCSoNwbDOGvJ1S5WOPbABbug,Nghe nhạc là biết beat của masew làm,0
0yHtYPeK2Jg,2023-03-21 16:44:50,UCOI2FwLk_mtkTjhVUl-FdnA,"Mình thích đoạn đèn led biểu tượng tuồng cổ sau đó hiện ra khuôn mặt Hòa, như dụ ý đời và kịch có sự liên kết, đời thực vẫn còn những thị mầu vẫn còn tồn tại, đó là cách khuyên giới trẻ luôn giữ gìn những gì gọi là cốt cách tốt đẹp của người phụ nữ VN. Cám ơn Hòa đã ra 1 sp âm nhạc chất lượng mang đậm chất âm hưởng xưa kết hợp hiện đại ❤❤❤",0
0yHtYPeK2Jg,2023-03-21 17:05:46,UCtdsgMVGxBITp8MS7Ap3tFw,HAY QUÁ BÀ MẦU,0
0yHtYPeK2Jg,2023-03-21 20:16:35,UCyjxUHUR-QnFarOcbCfIo7A,Chất nhạc Masew vẫn vậy. Luôn có 1 khúc để fan nghe phát ra luôn nhạc ai làm.,0
0yHtYPeK2Jg,2023-03-21 22:16:09,UC_p3Loqi2xIGvnFhAfi_6lg,Thi Mầu Xinh Quá,0
0yHtYPeK2Jg,2023-03-21 22:54:43,UCTmMSai2gDzVrI5_e5b65Qw,Tự xưng em là Thị Mầu Ý là con gái phú ông Tuổi em chứ còn bé lắm Cũng chưa đến trăng rằm  Ơ này chị em ơi  Nay tư mới đã mười lăm Ai muốn đi ăn oản  Thì lên chùa với em  Ớ ơi à ời à ời à ời à Em lên chùa từ mười ba Ớ ơi à ời à ời à ời à Em lên chùa ngày mười lăm  Này thầy Tiểu ơi Em là Thị Mầu Em không biết đâu Em cứ bắt đền Gọi mẹ thưa cha Ăn vạ cả làng Cho em lấy chàng Tình tang tang tình tình tang,0
0yHtYPeK2Jg,2023-03-21 23:22:55,UCHvjREvL0hIIulA_e_VXdNA,❤❤❤,0
0yHtYPeK2Jg,2023-03-21 23:47:40,UC_p3Loqi2xIGvnFhAfi_6lg,Vẫn đang nghe ủng hộ Hoà Minzy nè.,0
4qNALNWoGmI,2023-03-21 00:42:30,UCnbtyQDvup64BzecvddcVYQ,lich,0
4qNALNWoGmI,2023-03-21 01:23:11,UCNa2XHoqnudzoX-avs2vfYA,A yêu amee,0
4qNALNWoGmI,2023-03-21 01:29:18,UCsZZAcWvP7YzULNa--rBndg,ghiền mỗi bài này của Ameericano :))))) ❤,0
4qNALNWoGmI,2023-03-21 01:51:59,UC6S3B1yf7KQCLIhXD13GQpQ,Nên có bản vietsub,0
4qNALNWoGmI,2023-03-21 02:08:22,UCvzwJJAU0k2tECt4GpbIPkA,bài như lồng mẹ bao la,0
4qNALNWoGmI,2023-03-21 02:17:44,UCfFw8D7nEKLIAtkQ6PZhTIg,"This playlist takes me on a journey, from happy to sad to nostalgic.",0
4qNALNWoGmI,2023-03-21 02:52:27,UC6nX0Jq6vbZiuvYXljqyFQQ,❤,0
4qNALNWoGmI,2023-03-21 03:19:19,UCAXLzC8JBHZEJvfwQOPJFDw,"Kiếm bé Nâu với Mỹ Diệu 1:07, ô thứ 5 hàng dưới :))",0
4qNALNWoGmI,2023-03-21 03:34:35,UC5aj9sgzRs_bNJqIZIaw5bQ,Thề ko thể hiểu nổi đang hát cái gì -_-,0
4qNALNWoGmI,2023-03-21 04:07:05,UCAi6RVuDD5tivIgVFfUaLVg,hát thua thằng cháu Đăng nhà tao,0
4qNALNWoGmI,2023-03-21 04:40:52,UCq7vAw4w5-c3GKFtvgeBcGQ,Moé giọng nổi hết cả da gà 🤣🤣,0
4qNALNWoGmI,2023-03-21 04:52:59,UCu4NkcRKBCq2R43UqBmDJgw,Tưng Tứng Tưng Từng :)),0
4qNALNWoGmI,2023-03-21 05:53:15,UCMGb_DwQse6oOu0RVkcXCAA,Hay quá c owiu,0
4qNALNWoGmI,2023-03-21 05:54:08,UCanYI8Dditr6R4Ur7cibEjQ,lời bài hát đáng yêu zậy 😅,0
4qNALNWoGmI,2023-03-21 05:55:23,UCoo0m9eoghTrTEyGu4gchfw,Ko hay lắm nha chị,0
4qNALNWoGmI,2023-03-21 06:29:11,UCX1RaqtXX7gNLNoX9NEccdg,"Giai điệu nghe rất bắt tai, ưng nhất đoạn: Tắt đèn đi trả lại tâm trí đâyyyyyy, meow meow meow meow Trả lại tâm trí tôi đây Cứ như một con Tấm tắm trong khu vườn nhà, Rất, trong lành có ong lòng, em có anh ...",0
4qNALNWoGmI,2023-03-21 06:56:18,UCHssCusaMuyiZcMPi0C5v1Q,Trần Đức Bo đã xem và đang tập hát🙀,0
4qNALNWoGmI,2023-03-21 07:17:52,UC82leNhS18ENGv8elxKbHFg,Nghe trên tik tok cứ thấy là lạ ra nghe full hay phết,0
4qNALNWoGmI,2023-03-21 07:35:03,UCk6ViLDTdwLPqiS7iiPlDGQ,Bài hát dễ thương dì đâu ák,0
4qNALNWoGmI,2023-03-21 09:05:28,UCnIhHMFtQM9_GVw3bP2GuTQ,"Hay quá, bài này siu cấp dễ thương luôn, mãi fan mều simmy",0
4qNALNWoGmI,2023-03-21 09:15:14,UCAAKGRHa4fF4Ve3WprIqYWQ,NÃO ĐỊT SẢN XUẤT BÀI NHƯ ÓC LỒN TẠ CẶC ĐẦU BUỒI,0
4qNALNWoGmI,2023-03-21 09:22:27,UCipZo_ZNsAysEeg8fXqBHOg,ai h cũng mèo meo meo meo hoảng vl:))),0
4qNALNWoGmI,2023-03-21 11:07:03,UCrArhg3pVAPLkA9AL74hBUg,Meow meow meow meow meow meow,0
4qNALNWoGmI,2023-03-21 11:23:29,UCfyCaKR0sh1g1LePO3A4Gzg,Ai chê thì cứ chê còn t thì mê😂😂,0
4qNALNWoGmI,2023-03-21 11:40:18,UC_fKnppV3qxwQdiiy0IVPmg,Ủa đây là official clip chưa vại? Giờ mới thấy nó chỉ lặp đi lặp lại 4-5 lần😂,0
4qNALNWoGmI,2023-03-21 12:09:39,UCAgmTNgFMRqBJ4j53QbcRbQ,anh yêu em,0
4qNALNWoGmI,2023-03-21 12:34:23,UCmlEGP5UHVriMJR9RBDUMmQ,Bài dở ẹt mà nghe đc,0
4qNALNWoGmI,2023-03-21 12:45:21,UCC8n4TPstPY4h7rGndJ_Dng,Bài hát nghe ung thư quá ạ,0
4qNALNWoGmI,2023-03-21 12:48:19,UCGWQXfB7US3xoN7jkyUPmWA,"Mong sao amee cùng bray tiếp tục ra bài mới, nhớ nhạc 2 ng ft với nhau quá",0
4qNALNWoGmI,2023-03-21 13:02:18,UCz6jbpJwUTSWEvFdHhlLKDA,nhạc như đặc cầu,0
4qNALNWoGmI,2023-03-21 13:17:26,UChUUwVPbicJXQjUvg2C7E-w,Đoạn điệp khúc nghe ở đâu rồi í,0
4qNALNWoGmI,2023-03-21 13:22:00,UCh55pJtzpnlOFDKCP-0t7kg,Bài hát cute quãi,0
4qNALNWoGmI,2023-03-21 13:22:23,UCBziB0X4goYWiUC1fkbA_BQ,Sao tôi nghe ra tắt đèn đi ko vậy nhỉ :))),0
4qNALNWoGmI,2023-03-21 13:33:44,UCeROd0BovGzD40cZWVwejpw,Rồi nó đang hát cái quái gì mà cứ mèo chó gấu heo vậy,0
4qNALNWoGmI,2023-03-21 13:36:22,UClaSz4XoBv1YnFAJDo6ca8g,Mỹ diệu meow meow,0
4qNALNWoGmI,2023-03-21 13:45:40,UCWtGHTncMe-3neqMLcX6asA,Ám ảnh nhạc thời nay:/,0
4qNALNWoGmI,2023-03-21 13:54:24,UCKj79t1wQkrCiSk3LVr62KQ,hay vai loz,0
4qNALNWoGmI,2023-03-21 14:04:15,UCC4yZa7g3pB1Ess2qvCLmtw,Bánh cuốn vãi luôn,0
4qNALNWoGmI,2023-03-21 14:04:32,UCu-o0KDtNh3zZCfwMnUnyPQ,Giai điệu gây nghiện :3,0
4qNALNWoGmI,2023-03-21 14:59:08,UCEztkLqft_6ogwlw1xRzJ_g,Như đầu buồi💩,0
4qNALNWoGmI,2023-03-21 15:36:29,UCErIODW_Lq2jnY9K-P8uceg,"Cám ơn Amee. Nghe bài hát xong tôi mới biết mình thối tai, không ra được chữ gì luôn",0
4qNALNWoGmI,2023-03-21 15:38:39,UCOMNVHpYnGgmj-TBW2-3U5g,đáng yêu quá đi <333,0
4qNALNWoGmI,2023-03-21 15:45:15,UCE4ul6WjmbCTrOcDLb4W_PA,"Thz bạn tôi bị gãy chân , khi nghe đến giọng amee , bạn tôi liền đứng dậy tắt ngay , cảm ơn amee và nhạc như lồn thật",0
4qNALNWoGmI,2023-03-21 16:34:42,UCGsYVAwKnt7FuzT60eexRIA,nghe nhạc Việt mà phải tìm phụ đề 😂😂😂,0
4qNALNWoGmI,2023-03-21 16:34:43,UCAylfnRkDaS_rVOT7dGV8Gg,Tao thích bài này chắc tao bị bê đê r,0
4qNALNWoGmI,2023-03-21 16:54:44,UCbiBSy-bl2rUe_WuIKyfUsA,Chê.bài hát này có beat và lời khá hoàn hảo nhưng trong 5phút bắt ng nghe phải đi theo 1 công thức đó là 1 bh gắn gọn dễ nhớ lời thật thì 1bh thể hiền về 1tình yêu mới chớm nở sẽ là lời bh ko bị lặt lại như dady cool. Có thể cho thềm 1 đoạn rap vào giữa hoặc đơn giản là 1 bh 3phút mà thôi. Nhưng cũng công nhận rằng bài này tạo trend rất tốt và dễ thuộc nên ko kén ng nghe mấy. Mà h các ca sĩ có tiếng cứ ra sp là chỉ cân có beat vời lời cuốn là cứ thành trend. Hậu quả của tik tok mang lại😅😅😅,0
4qNALNWoGmI,2023-03-21 16:56:34,UCObqgqjRT-0YrYIr2_zBnHw,Thấy hay mà meo meo meo meo rồi ai cũng thành mèo hoy,0
4qNALNWoGmI,2023-03-21 17:26:32,UCpPKFZUav9kaEkjGV9SMW1g,ủa bài hát hay quá heheehe,0
4qNALNWoGmI,2023-03-21 18:22:01,UC2u046KjqPUVMkUMm6ZL79g,"Nghiệm ngẫm j nữa ,  nghe riết ám ảnh",0
4qNALNWoGmI,2023-03-21 18:34:58,UCIFKkZjXg7cPvuL7bLfA_Qg,Nhạc cũng bắt tai mà lời thì ngộ quá,0
4qNALNWoGmI,2023-03-21 22:29:10,UCw6iFR6QaOlZK5UAcxRjiGQ,Nhạc VN style Newjeans :),0
4qNALNWoGmI,2023-03-21 23:55:26,UCrlkcOV-yLZaa4vHmiECPVA,dạo này nghe bài này nhiều quá đi đâu cũng nghe thấy :)),0
4qNALNWoGmI,2023-03-21 23:58:25,UCvCH8UE-7CT95wtaSSm0iRA,Hy qua,0
DC842pmeamA,2023-03-21 01:52:31,UCixoEBdvfQui5k62LIqSkpg,Tui hay nghe bản remix. Nhưng giờ bản Lofi củng rất chi là hay. Mê mê quá,0
DC842pmeamA,2023-03-21 02:04:55,UCZVEVKnZeCiSYBTheh7uDwQ,mê,0
DC842pmeamA,2023-03-21 05:01:29,UCvtqoEfgtMCYlo-BvJcHMdQ,cuốn quá,0
DC842pmeamA,2023-03-21 07:10:47,UC3Z5VN_vbK1KYdGWjFfl_zQ,qua đường lê văn duyệt bên chỗ gần extrim ấy gió thổi cái mát rượi,0
DC842pmeamA,2023-03-21 07:15:47,UCtnp56uCFFgzOi8B2Ka3ynA,có ai thấy giọng jank giống giọng bùi trương linh giống tớ không?🧐😕,0
DC842pmeamA,2023-03-21 07:47:52,UCgcmfcT_WcFJt_Rb8_TYyMg,Giống cr z t z,0
DC842pmeamA,2023-03-21 08:16:09,UCu-o0KDtNh3zZCfwMnUnyPQ,Chúc mừng Quân nha <3 Chúc mừng 1967 x N2L <3,0
DC842pmeamA,2023-03-21 08:57:43,UCB2oxfaiVsRXXmv4nGA-9gw,Càng hi vọng càng thất vọng 😢,0
DC842pmeamA,2023-03-21 08:58:05,UCvfmDJ0TQhflhOfBSSfgZvg,quá hay luôn á,0
DC842pmeamA,2023-03-21 08:58:20,UCdET9S1w3vHXr9C94piMyKQ,tuyệt vời luôn ạ,0
DC842pmeamA,2023-03-21 09:08:34,UCXMvBZb84dOXZKBI44Wkfdg,Bài này đag hot nei,0
DC842pmeamA,2023-03-21 09:27:53,UCoItaPtHSRXtZ7Pl9ijqrUg,gió mang hương về giờ em ở đâu?,0
DC842pmeamA,2023-03-21 09:48:45,UCixoEBdvfQui5k62LIqSkpg,Tab 19 thịnh hành. Chúc mừng Quanvrox Music,0
DC842pmeamA,2023-03-21 10:33:06,UCWRJqDQJahNGe3ifYTWt5KQ,Lofi 1 mau nham vai,0
DC842pmeamA,2023-03-21 11:53:43,UCGnN26TD87xMoQNOYi5MFrg,Ôôôo9oooooôoôokkkkkkkkkkkkkkkkkkkkkkkkkkkkkkkkkkkkkkkkkkkkkkkkkkkkkkkkkkkkkkkkkkkkkkkkkkkkkkkkkkkkkkkkkkkkkkkkkkkkkkkkkkkkkkkkkkkkkkkkkkkkkkkkkkkkkkkkkkkkkkkkkkkkkkkkkkkkkkkkkkkkkkkkkkkkkkkkkkkkkkkkkkkkkkkkkkkkkkkkkkkkkkkkkkkkkmkkkkkkkkkkkkkkkkkkkkkkkkkkkkkkkkkkmmkkkkkkkkkmơkkkkkkkkkkkkkkkkkkkkkkkkkkkkkkkkkkkkkkkkmkkmkkkkkkkmkkkkkkkkkkkkkkkkkkkkkkkkkmkmkkmkkkkkkkkkkkkkkkkkkkkkkkmkmkkkmkkkkkk,0
DC842pmeamA,2023-03-21 12:24:25,UCNDNveQvQkgdZoU6ORkk_Ww,hm,0
DC842pmeamA,2023-03-21 12:24:29,UCNDNveQvQkgdZoU6ORkk_Ww,hm,0
DC842pmeamA,2023-03-21 12:36:20,UCnFa1sjNzIYxiI_MUJzgU1g,Nhớ😢,0
DC842pmeamA,2023-03-21 13:12:04,UCHqPurczhR3B3L7aC1iw0vw,.,0
DC842pmeamA,2023-03-21 13:17:15,UC4pNKe0Z7nZXycptPiwvLxA,"Đông chưa về , còn Xuân lại ..?",0
DC842pmeamA,2023-03-21 14:49:03,UCZpQ1jBHrrmgl0cyn_aCdag,hay,0
DC842pmeamA,2023-03-21 15:02:45,UC4MYxF-MOLJTxnfgl1sgXIg,Hay 😢😢,0
DC842pmeamA,2023-03-21 15:27:27,UCY7mB3sNW5eZHwGjepsrrRA,.,0
DC842pmeamA,2023-03-21 15:34:47,UCsIMLV0WBaze5Doyeu6BWgA,.,0
DC842pmeamA,2023-03-21 15:47:20,UCxacRmS5-5aaUStFMELxEhQ,"Một người.. đã dẫn tôi đến đây, chắc họ đã nghe bài này nhiều lắm, không biết.. trước đây, họ đã bao giờ từng nghe nhạc mà tôi để lại chưa nhỉ?! Không biết.. đã bao giờ họ thử cố gắng tìm hiểu những cảm nhận của tôi, những điều tôi muốn nhắn gửi qua lời bài hát không nhỉ?! 😊",0
DC842pmeamA,2023-03-21 15:56:09,UC7_po9_42X3FRml8sffhY_g,cuốn câu đầu của đoạn điệp khúc hihi,0
DC842pmeamA,2023-03-21 17:13:03,UC1ba71Z7vHle5BqSQR1UnHQ,hay đấy,0
DC842pmeamA,2023-03-21 17:39:14,UCiGO0AcLDKpktaTxBQWHvsA,con tim nát tan rồi còn lành lại được không?? 😢😥,0
DC842pmeamA,2023-03-21 22:43:49,UC6R0EbRJahggmobYhBaRkSg,☺️,0
DC842pmeamA,2023-03-21 23:53:52,UCnH5GcPneim0qZuu5oWT3Fg,bài nì hay,0
fyMgBQioTLo,2023-03-21 01:39:48,UCSlzcbUmX4_WBMU9j7Rij9A,<3,0
fyMgBQioTLo,2023-03-21 02:03:52,UC6SewXJF84SjWgZfzGU0_ZQ,Love you tlinh,0
fyMgBQioTLo,2023-03-21 02:30:35,UC9FLx2aIAiZHCIL32BFU-OA,SAD,0
fyMgBQioTLo,2023-03-21 03:36:13,UCffbd7YRoTNedvJjXhb_6iw,😍,0
fyMgBQioTLo,2023-03-21 04:05:24,UC-ozHO1FxFRKS2QTyZuXJXQ,Bài này xuất sắc quá !! Chúc mừng đồng chí TLINH 😚,0
fyMgBQioTLo,2023-03-21 04:22:53,UCbZ3nArbKoiIHSc7paCII4g,Bài này hay chos dder lun đó huhuhu khóc theo❤,0
fyMgBQioTLo,2023-03-21 05:24:33,UCNp1nel1Btrtg0lu12pZppA,Bài này hay 🎉❤,0
fyMgBQioTLo,2023-03-21 06:56:28,UCy0Bf3jtG_57z_JcJwAZuMQ,*Để yêu một người không quá khó*  *Anh có muốn làm điều đó cùng em?*,0
fyMgBQioTLo,2023-03-21 07:11:25,UC2uAJZ8rmrJdu5MlX1h35yA,hay ác,0
fyMgBQioTLo,2023-03-21 08:19:19,UCDGTiCTLPDDsjTmx1Tzy6wg,HAY QUÁ IDOL OWIIIIII,0
fyMgBQioTLo,2023-03-21 09:20:01,UCNHjeUTlpsRZMLLj_E0kBiw,Em hát cũng ổn nhưng ngồi hát bài này lạ lắm :vvv,0
fyMgBQioTLo,2023-03-21 09:52:20,UC_cxuelLhlKcrljdskOXrxw,🥰,0
fyMgBQioTLo,2023-03-21 10:13:42,UCjNfQzyrNkl7dUigwn_E8uA,Bài hát nói y hệt cảm xúc của mình,0
fyMgBQioTLo,2023-03-21 10:22:15,UC9SyM5cbgCtT9kiPG6Wir9Q,Mặc kệ mọi người chê toi vẫn thích bản phối của 2pillz,0
fyMgBQioTLo,2023-03-21 10:32:28,UCfFcpGQnGdw0-Yco6Y341ow,"có ai đang không nghe xong cảm thấy buồn như thất tình không ah? da diết và giằng xé quá... Thôi về ôm chồng vầy :( sợ mất nhau, sợ phải nói là  nếu lúc đó...",0
fyMgBQioTLo,2023-03-21 10:42:39,UCIn_nNDoOKKbz5nMfjZVc_w,❤️❤️❤️,0
fyMgBQioTLo,2023-03-21 11:12:34,UCzY5SOIz6tOl3I6F36DtyVg,Cuốn theé,0
fyMgBQioTLo,2023-03-21 12:09:57,UCqNYUGr-W-GOk2pljAEbH7g,quá đỉnh,0
fyMgBQioTLo,2023-03-21 12:42:20,UCtC-RrXXWVWAwUKbIKLl4dQ,Coi muốn khóc 😢,0
fyMgBQioTLo,2023-03-21 13:04:24,UCi-hiH5ueiZt2GCcmGRqlaA,quá đã,0
fyMgBQioTLo,2023-03-21 13:11:05,UCHAOo_RAyk4STP9eOKGMUqg,Nhạc bạn này hay vãi... 1 bài nhạc Việt mà mình replay ko biết bao lần!!!,0
fyMgBQioTLo,2023-03-21 13:28:09,UC5SZt-m2c7WXzB_4ZgyM6Ew,hay quá chị iuuuu :>>,0
fyMgBQioTLo,2023-03-21 14:40:54,UC3psVm9SB8EMxX0Wiy94GZw,Nhạc tlinh là mụt cái dì đó 🎉,0
fyMgBQioTLo,2023-03-21 14:59:12,UCF1kYpOuTsUo5XmBTitTzMQ,Good Job for you TLINH,0
fyMgBQioTLo,2023-03-21 16:09:31,UCnoRWyXdRSdpAV9DMwYcmnA,"tlinh nhớ nhung và move on ngay trong 1 mv,dù tui chưa move on hắn,sau khi nghe bài này đỡ hơn chút,sự mãnh liệt của tuổi trẻ,khi nhìn lại ta sẽ ko nuối tiếc chỉ là chấp nhận buông bỏ ,mình đã khóc khi tlinh hát thứ lỗi cho em thật sự quá đúng với mình,mình đã hờn trách họ và quên mất những lỗi lầm của bản thân,tlinh mãi keooo huhu",0
fyMgBQioTLo,2023-03-21 16:40:31,UCbfC8D1JAQtZI8ASmPmz4fQ,"Hôm nay chúng ta chia tay, em không thể nói hết với anh những lời em muốn nói. Em xin lỗi vì phải nói lời chia tay khi chúng ta còn yêu nhau. Em không chắc mình có thể chịu đựng được bao lâu. Từng lời bài hát đều là em muốn nói với anh. Em mong sau này chúng ta đều hạnh phúc. Em mong quyết định của em bây giờ là đúng. Nếu tương lai chúng ta còn đủ duyên nợ, chắc chắn còn gặp lại, nếu không thì đành thôi vậy.  NPTK",0
fyMgBQioTLo,2023-03-21 17:32:56,UCwqTkzgDKiCX0w8o3Ddugsw,hay quá tlinh uiiiiii <3,0
fyMgBQioTLo,2023-03-21 23:52:46,UCGJNOOvf9i-WOn_3aiL7NDg,Nghe đi nghe lại ko chán 😊,0
lB3SRFPYf98,2023-03-21 00:33:53,UCJX6NR58Wug6gNnK3W08Lhw,"K thể kìm nổi nước mắt khi nghe xong bài này, mik cảm thấy mik quá ích kỉ chỉ bt nghĩ cho bản thân, nhiều lúc mik cảm thấy a ấy vô tâm với mik k còn thg mik như trc mik đã trách a ấy rất nhiều nhưng mà mik lại k nghĩ rằng a còn rất nhiều thứ phải lo còn có gđ bạn bè việc học tập và còn phải lo cho sự nghiệp tr tg lai nữa thật sự xin lỗi a rất nhiều",0
lB3SRFPYf98,2023-03-21 02:07:59,UCFuD8ifmNyKdpJMRVvI7ZJw,"Xem MV nhớ lại năm tháng hồi còn đi học nhiều kỷ niệm,",0
lB3SRFPYf98,2023-03-21 02:55:19,UCQD2p_0nalXOMjXXwSO0LzQ,"Chả hiểu sao tớ nghe bài này nghe đi nghe lại từ hôm ra đến giờ rồi. Giai điệu và lời bài hát khiến tớ thấy bạn nam áp lực trong độ tuổi mới lớn chênh vênh, lo lắng cho sự nghiệp, bất lực vì bạn nữ không tin tưởng đôi ba lần giận dỗi để r sự bất lực ấy đã khiến họ dừng lại. Hình như tớ lại thấy cảm giác không an toàn của bạn nữ. Sự tổn thương, sự lo lắng. Muốn được thấy anh nỗ lực cố gắng chứng tỏ anh yêu cô ấy nhưng lại vô tình khiến anh thấy áp lực và mệt mỏi hơn. Cuối cùng họ chia tay! Anh yêu cô ấy nhưng không phải theo cách cô ấy muốn.",0
lB3SRFPYf98,2023-03-21 03:25:54,UCZKp01odYbB0BNPevRPFYXw,❤,0
lB3SRFPYf98,2023-03-21 03:26:01,UCZKp01odYbB0BNPevRPFYXw,❤,0
lB3SRFPYf98,2023-03-21 03:39:54,UCrZbMcdtO-TJ7l-7fc06CFA,Buồn lắm,0
lB3SRFPYf98,2023-03-21 04:06:38,UCo5V2XDIOlRmOk2yCtZbv1w,"Mình và anh yêu nhau êm đềm và hạnh phúc, tình yêu của bọn mình đơn giản chỉ cần nhìn nhau thôi đã thấy vui rồi. Cũng có đôi lúc cãi vã vì những chuyện vô cùng nhỏ nhặt, rồi ngày hôm đó bọn mình cũng cãi nhau vì câu chuyện đơn giản như vậy vì mình cảm thấy anh không quan tâm đến cảm xúc của mình. Mình nghĩ anh sẽ vỗ về mình như những lần khác nhưng lần này anh lại nói anh không còn tình cảm với mình nữa, anh nói anh không chịu nổi nữa, anh muốn dừng lại. Mình như chết lặng, vài ngày sau vẫn luôn hỏi anh chắc chắn rồi à nhưng chỉ nhận lại sự lạnh lùng thôi. Lúc đó mình biết vị trí mình ở đâu rồi, mình quyết định buông bỏ.",0
