videoId,updateAt,authorId,cmt,label
fyMgBQioTLo,2023-03-15 07:16:47,UCAYHdODjYMb48BnwYj_Jwaw,"Verse 1  nếu lúc đó em không buông tay  nếu lúc đó anh không lung lay  nếu lúc đó ta không trốn chạy  không giấu những thứ không muốn nhau thấy   nếu lúc đó mình đặt lên nhau  nụ hôn đắm đuối như thể lần đầu  nếu lúc đó mình đừng giả vờ  vờ như mọi thứ không làm mình đau  nếu lúc đó thế giới đừng quá ác độc với 2 đứa nhóc  không thể cho phép mình yếu lòng vì quá quen việc phải gai góc  những vết cắt chưa lành được rồi lại gồng mình, chẳng còn biết khóc  và nếu em không, và nếu em không   nếu lúc đó em không ám ảnh 1 ngày anh sẽ biến mất  nếu lúc đó anh cho em thấy em luôn là người duy nhất  nếu lúc đó mà em tin anh, mà anh tin em, mà ta tin nhau  Chorus  liệu mình sẽ còn ở bên nhau  liệu mình sẽ còn ở bên nhau  cười mỗi khi nghe thấy tên nhau  liệu mình đang còn đắm say đắm say  như ngày đầu tiên mình đến bên nhau  ngày em đã thức hàng đêm để nguyện cầu  ngày em tự hứa dù có thế nào, em sẽ vẫn yêu anh  liệu mình còn yêu?   nếu lúc đó ta không buông tay  nếu lúc đó ta không trốn chạy  nếu lúc đó mình đừng như thế  có lẽ… có lẽ…  Verse 2  nhưng có lẽ mọi thứ đã phải diễn ra như vậy để em thấy  em phải yêu mình  đã đến lúc em phải nhận ra em đã luôn tự lừa dối con tim  vì nếu anh muốn, anh đã tìm cách  nhưng anh chẳng hề gì   em ghét cái cách em luôn bào chữa cho mọi lần anh vô tâm  em ghét cái cách em nói em vẫn ok khi em tủi hờn  ghét dư luận tàn nhẫn  ghét nghĩ đến anh nhiều quá mức  ghét việc phải giữ yên lặng, tỏ ra mình không vướng bận  nhưng em cũng đã không ít lần gây ra lỗi lầm, thứ lỗi cho em  hứa với anh những điều giờ chỉ là ảo mộng, thứ lỗi cho em  bước đi vì em phải cần tự chữa lành mình, thứ lỗi cho em  cho phép mình nhận tình yêu mới đến rồi, thứ lỗi cho em  tập chịu trách nhiệm cho cảm xúc của mình, thứ lỗi cho em  trân trọng những gì em đang có, thứ lỗi cho em   em mong anh cũng vậy   Chorus  để 1 ngày mình sẽ lại đến bên nhau  1 ngày mình sẽ lại đến bên nhau  cười khi bắt gặp ánh mắt nhau  dù mình sẽ không còn đắm say đắm say  như ngày đầu tiên mình đến bên nhau  nhưng mình có thể làm quen lại từ đầu  chẳng còn 1 nỗi sợ hãi hay nghi ngờ nào nữa đâu  anh thấy sao?",0
fyMgBQioTLo,2023-03-15 07:23:35,UClaMExhxsLIdEKonAEzIeqQ,10 out of 10,0
fyMgBQioTLo,2023-03-15 07:41:50,UCZHcUXAuMNoFb_1lD5HKZNg,giá có nút 1000 like.,0
fyMgBQioTLo,2023-03-15 08:07:34,UCETeheyD9_yxwljSgODYzYQ,qua hay,0
fyMgBQioTLo,2023-03-15 08:08:50,UCUUahQTK4DxE7LmhFnNlShw,NGHE THẤM QUÁ,0
fyMgBQioTLo,2023-03-15 08:12:33,UCKHamxuoStsWWZKVpO_7atA,NGHE THẤM NẾU LÚC ĐÓ ANH CHỜ EM THÌ MÌNH ĐÃ KHÁC,0
fyMgBQioTLo,2023-03-15 08:13:03,UCRUl-iK6hGeIiywWoVgLWuA,Nghe bài này cảm giác trở về năm 2012-2012 ghê ❤❤❤ hay quá,0
fyMgBQioTLo,2023-03-15 08:16:16,UCILmk51R19emPA_cEqJvXcg,NẾU LÚC ĐÓ MÌNH TIN NHAU HƠN THÌ MÌNH ĐÃ CÓ NHAU,0
fyMgBQioTLo,2023-03-15 08:17:28,UCLw2kt21vUrwoK3o_XKel2w,dính quá luôn chị ơi chúc chị mãi thành cônggg,0
fyMgBQioTLo,2023-03-15 08:28:58,UCqEA3lJ6ors_b46wYJQa7zA,hay quá ạ,0
fyMgBQioTLo,2023-03-15 08:33:09,UCLZdWF9snjdxn10A6WZN3tQ,chả ra gì,0
fyMgBQioTLo,2023-03-15 08:55:39,UCu8IzzEPksXEXB2WveKTdRA,"may quá, tưởng ghệ iu 2 thì chắc t vứt đt đi luôn quá",0
fyMgBQioTLo,2023-03-15 09:01:49,UC59Y-vDd-x1t4ush95V-IdA,"el producto nunca nos decepcionó, siempre es una obra maestra. Sus voces son tan hermosas y suaves!!!",0
fyMgBQioTLo,2023-03-15 09:18:44,UCVz18evLmoQmU0zNt9Sj9zg,lyrics này liệu có phải là chuyện tình đoạn thời gian trước của tlinh vs MCK ko? Nghe sao mà chua xót quá :( MCK cũng mới ra album 99% nữa :( 1% MCK còn thiếu kia liệu có là .... tlinh ko?,0
fyMgBQioTLo,2023-03-15 09:54:34,UChpHq8ilQLVDqFrEP7OxvCg,1 từ thôi  HAYYYYYY❤️ Nghe thấm từng câu hát 😌,0
fyMgBQioTLo,2023-03-15 10:26:29,UC5C3OcVhp4pRL1ewa8KNdcw,Cảm ơn chuyện tình của 2 người nhé… tự dưng nhìu nhạc hay để nghe vcl🎉🎉 cứ chân thật với cảm xúc của mình thoii ❤ lớp diiuu ❤‍🩹❤‍🔥,0
fyMgBQioTLo,2023-03-15 11:20:12,UCgTp-iJXnI5Z0kHcBCIIlDQ,"đỉnh thật sự, giỏi quá",0
fyMgBQioTLo,2023-03-15 11:27:58,UCY-lVWYnaJXItxnwnztbmUw,Nghiện roàiiii:3,0
fyMgBQioTLo,2023-03-15 11:35:28,UCQB0OOkVcc5g1xsxYGNN5zw,💓,0
fyMgBQioTLo,2023-03-15 12:05:09,UCJeccUB6cg9Z-3bdocYpV3Q,Mê bài này thật luônnn,0
fyMgBQioTLo,2023-03-15 12:12:46,UCXDOiaUBFe8cWXsMIQxWguw,Đúng tâm trạng lúc này ghê 😢,0
fyMgBQioTLo,2023-03-15 12:34:45,UCsZz9wgMwlp0KXpyImVQKDQ,nice song,0
fyMgBQioTLo,2023-03-15 12:45:42,UCdQyqxfQFyDJCESe-hCovcQ,Ngày nghe chục lần vẫn k chán là seo 😅,0
fyMgBQioTLo,2023-03-15 12:46:28,UCXEvvE--yU6h2329koqO1Gg,hay quá chị uiiiii<333,0
fyMgBQioTLo,2023-03-15 12:47:12,UCwbU1v6J8YDMJzbSWhpqOFg,"Mình đã khóc khi nghe bài này, có lẽ là vì nhìn thấy chính mình trong đấy",0
fyMgBQioTLo,2023-03-15 13:01:31,UCQve2T97HUKSbcuY2LeXhOQ,Biết đâu lại quay lại vs mck,0
fyMgBQioTLo,2023-03-15 13:11:59,UClUaKE9ayoTLGKrbjEw1B8g,thấm,0
fyMgBQioTLo,2023-03-15 13:14:26,UC2WlP_lLl-3UcPkRs6Ixjlw,Nghiện bài nàyy gkeee,0
fyMgBQioTLo,2023-03-15 13:21:37,UCjRyNrZoqaH_koHGrrN6p6Q,Ko hiểu sao rap việt bây h lyrics ngang phèeee,0
fyMgBQioTLo,2023-03-15 13:32:28,UCkeMyUDdXuxBeJ-A3R6J0bA,Căng đét ❤,0
fyMgBQioTLo,2023-03-15 13:45:02,UCbD0z8EZaHttJn81LTfp2CQ,gu thời trang con này như bà già chẳng ra làm sao lễ hội Halloween 🎃 thì k. !  chắp vá  te tua 🤣 hiệp hội nhặt ve chai còn thua xa,0
fyMgBQioTLo,2023-03-15 14:10:15,UC9voPQElvp4_EdbQFJ8PZ1w,hay thật chứ❤❤❤,0
fyMgBQioTLo,2023-03-15 14:12:30,UC7hCjfmD4tQBA4TV7pM424g,Vừa nghe vừa khóc...,0
fyMgBQioTLo,2023-03-15 14:23:35,UCu_wuWa4392L3jL3KLA8BoQ,💕from Kuwait 🇰🇼,0
fyMgBQioTLo,2023-03-15 14:39:31,UCE5RxUms6cSiNoMugeAEGJA,tự dưng thành fan của tlinh :)),0
fyMgBQioTLo,2023-03-15 14:49:41,UC9gGKj5uNrKqoDmcM12nIUw,.,0
fyMgBQioTLo,2023-03-15 15:17:47,UCSQ8OoWoYN2CbW8mvi4hlLQ,lép,0
fyMgBQioTLo,2023-03-15 15:20:22,UCEGkyYFnJUlXyW0twc2NlFQ,Hay đến xé ruột gan luôn ý,0
fyMgBQioTLo,2023-03-15 15:21:46,UC3_-GkCjVgctjaIa8Vxmykg,Vớt vát cho GYDCE =))) chắc lúc đó Tlinh bị ma nhập =))),0
fyMgBQioTLo,2023-03-15 15:22:23,UCxP-M51FJ1nOdqb-UU9KefQ,mê quá,0
fyMgBQioTLo,2023-03-15 16:02:03,UCdV3gtS1McLxH08ZFWyn_AA,😍❤️,0
fyMgBQioTLo,2023-03-15 16:10:50,UC0Ga7tnJpU0CZmZe6WJQdjA,hay quá đeeeeeeeeeee<3 <3 <3,0
fyMgBQioTLo,2023-03-15 16:33:42,UCDZeO8XsezXcxvFLKPLyaXA,Bài này vào top 100 bài hát đang thịnh hành trên thế giới rồi,0
fyMgBQioTLo,2023-03-15 18:24:32,UCq9KcYyoAENdCIPk12z9s_A,"Tlinh hát ổn phết, dù còn cần tròn vành rõ chữ hơn nhưng bài này hơn hẳn các bài dễ dãi đóng tune trc đây. Rất đầu tư về tư duy nhạc và clip nữa, good job!",0
fyMgBQioTLo,2023-03-15 19:25:00,UCaMynnBOAzPF2qdHo6ovsPw,Quá hay! Bài ghệ cũng vậy!,0
fyMgBQioTLo,2023-03-15 21:57:07,UCkeXwwLITmSlCXYUWKci8Kw,hay,0
fyMgBQioTLo,2023-03-15 23:37:33,UC-M51d3nCG7llZX1-WF-AUw,.,0
fyMgBQioTLo,2023-03-15 23:47:13,UC9slBSEtZje6dfawEP6hoJg,.,0
lB3SRFPYf98,2023-03-15 00:13:58,UCeZac8Qa4kBuyzs-RWqojTQ,đang chill chill đoạn đầu ông nguyên đâu ra lọt vô ông vũ kia cái giọng ối dồi cái out luôn :))),0
lB3SRFPYf98,2023-03-15 00:16:46,UCJ-U1lQrXBcpwl3FIhuiKUg,"Anh đã từ bỏ rồi, đấy hẹn em yêu ở lần thứ 2..",0
lB3SRFPYf98,2023-03-15 00:19:06,UCpSvm8hrNPo9oUnzGRKIWcw,"14/3 năm nay thật khó quên,nhìn người mình thương yêu người bạn mình thân 😔",0
lB3SRFPYf98,2023-03-15 00:20:56,UC_bjsmSEeAaOcLJyp_3GfLA,"ht, em nho anh nhieu lam..",0
lB3SRFPYf98,2023-03-15 00:21:25,UC2DcWl623ZTcsQwKLGbJIDA,<3,0
lB3SRFPYf98,2023-03-15 00:32:15,UCZm2BxijSeKaq4SrzvUeOGQ,Đây rồi ❤❤,0
lB3SRFPYf98,2023-03-15 00:32:20,UC45s68bHou6C3yk6TYQtX2w,Hay quá anh ạ 💖💖💖,0
lB3SRFPYf98,2023-03-15 00:33:24,UCqbwyqQ886RDBLtaXuWQsHg,Mê nhạc Nguyên quá 😍,0
lB3SRFPYf98,2023-03-15 00:47:56,UCw0knmHO6Sfbvf5RDblV2Iw,"Cha mẹ già vất vả đêm ngủ chẳng ngon , Phận làm con anh đây chữ hiếu chưa tròn  tại s lại rưng rưng như vậy cơ chứ 🥲",0
lB3SRFPYf98,2023-03-15 00:52:01,UC4YnyJFcW2DO-v13UriwH8A,1 chất nhạc rất khác và nghe rất thấm,0
lB3SRFPYf98,2023-03-15 00:53:41,UC8a4U_yCtJ-C78NNeDld34g,thực sự cả 2 bài mới ra của a e nghe mãi thui í…. nghe buồn quá trời di ạ. chúc những sp sắp tới vẫn sẽ dc mng ủng hộ ạ❤❤,0
lB3SRFPYf98,2023-03-15 00:56:21,UCO56SrV3qrjiBwGxRMCFMvA,Ra karaoke đi a,0
lB3SRFPYf98,2023-03-15 01:10:16,UCpES7YLi9WiC0bHeINsJJVA,Huhu cuối cx cũng đợi được ra bản full,0
lB3SRFPYf98,2023-03-15 01:20:35,UCg_GMn-4pPL7BbmNJXF3fZQ,Không uổng công mình chờ đợi. Lên Apple Music nhanh nhanh bạn ơi 🎧🎧🎧,0
lB3SRFPYf98,2023-03-15 01:22:29,UCQXJAu6BpJ0Q9sddGHexDHQ,Hay quá ạ ❤️,0
lB3SRFPYf98,2023-03-15 01:36:22,UCI8WiZsNtBHZnXVfl0m7jKA,Thanh xuân này cứ ngỡ ở bên nhau cuối cùng vẫn phải từ bỏ ^^ Sau tất cả cuối cùng cta lại chọn rời xa nhau rồi . Em vẫn còn thương anh đúng không ? #MH,0
lB3SRFPYf98,2023-03-15 01:39:23,UCcqdPbhRFXbUYUUSHh16IxQ,"Không ai muốn phải chia xa, rồi làm bạn với người mình yêu nhất cả...",0
lB3SRFPYf98,2023-03-15 01:45:30,UCJ1IxEEQiEWV2H6GmXb0t6g,Cuối  cùng cũng  ra mắt,0
lB3SRFPYf98,2023-03-15 02:04:59,UCSErjnMgfyC0N0V4XzVV1Pw,anh thương cho người con gái cạnh bên anh dẫu chẳng có tương lai,0
lB3SRFPYf98,2023-03-15 02:07:03,UCVggzF2s9K5PRXGjCkdryzQ,😎,0
lB3SRFPYf98,2023-03-15 02:08:17,UCJe88gBrteJBSxvcyOt2zYQ,hay quá a ơi đúng tâm trạng e luôn,0
lB3SRFPYf98,2023-03-15 02:11:14,UCm3N5zREOydsfOgzf-MILaA,"Một bản nhạc tuyệt vời , thật yên bình , thật sâu lắg , từg câu từg chữ in sâu vào trái tim ... 😊",0
lB3SRFPYf98,2023-03-15 02:12:23,UCqDZJ92IbBa8fwNA8_2MXtw,👍,0
lB3SRFPYf98,2023-03-15 02:15:25,UC4xG8RhN4LDHE2vSRGYwxvg,-)),0
lB3SRFPYf98,2023-03-15 02:25:20,UCyG2dpBL8rKX9DGs1ikWZHQ,75k view gòi đỉnh đỉnh đỉnh,0
lB3SRFPYf98,2023-03-15 02:27:54,UCc7OPTefxy7nGFw47zxDkuQ,Nhạc của a rất chill và rất ý nghĩa ❤❤,0
lB3SRFPYf98,2023-03-15 02:32:52,UCWnO2XfH5PX-F4PEriZyZ5g,"hay lắm ạ, em chờ lâu lắm để ra full ròiii",0
lB3SRFPYf98,2023-03-15 02:42:20,UC9hbG6HiaBrnJqbvDzhHiFA,Có nét giống bài cũ quá,0
lB3SRFPYf98,2023-03-15 02:44:44,UCDEFNMOyyBIgACbV8MiEZTg,Một người mê nhạc buồn như mình thì sau 2 bài đã chìm đắm :((,0
lB3SRFPYf98,2023-03-15 02:48:58,UCiXC3kySIjojSd_59l8D4Jg,Giọng hát không hay,0
lB3SRFPYf98,2023-03-15 02:57:11,UCafGKg3wmrk_QOMZ8k8_Ogw,"Dành hết cả thanh xuân này cho nhau, liệu còn bên nhau lúc mai sau? Có phải ngay lúc đầu, em đã chẳng chọn anh đâu?  Dành hết thanh xuân này bên nhau, bây giờ thanh xuân ấy nơi đâu?  Có phải ngay lúc đầu, ta vốn chẳng dành cho nhau?",0
lB3SRFPYf98,2023-03-15 03:07:43,UCZPZg0ahS2k9-gSNMQI2DxQ,Hay quá ❤❤,0
lB3SRFPYf98,2023-03-15 03:11:43,UCvUMPDDZDJ13-cK2Z_7HRjw,bạn cứ theo dòng nhạc này mình rất thích,0
lB3SRFPYf98,2023-03-15 03:12:35,UC8qOD3fgonBdH2ItCcLB5vw,ra nhiều bài indie kiểu này nhaaa,0
lB3SRFPYf98,2023-03-15 03:15:41,UCQPWf1tx-rwPIkrJu6dRr_g,đợi mãi,0
lB3SRFPYf98,2023-03-15 03:23:29,UCFYjQkJetlKvQ7OYG5IdmiA,Nhạc ông này hay ghê,0
lB3SRFPYf98,2023-03-15 03:28:34,UC6r7YxY7BUxbKhi5VxvXhHg,Hay thật sự ý ko uổng công chờ đợi🙆🥰 chúc 2 anh thành công nhé ❤️,0
lB3SRFPYf98,2023-03-15 03:29:32,UCkGkyX5buXQmz5BTTZLGYag,Hay thật sự luôn. Quá hay,0
lB3SRFPYf98,2023-03-15 03:33:13,UCRZS8PpkegtHLVdj_Xs2aEA,Chúc bác Nguyên sớm dành được nút vàng nhá,0
lB3SRFPYf98,2023-03-15 03:46:51,UCR9yUr8OfO9SW0RYij4qgLA,"Nhạc này xem thì nhớ về thời thanh xuân, còn nhạc thì nó cứ thấm vào từng thớ thịt. 😤😤",0
lB3SRFPYf98,2023-03-15 03:47:00,UC1e_ti5snBh0ZB9RR6hsGDQ,Mỗi lần nghe anh hát là tui cứ bật khóc Ko hiểu sao 😢,0
lB3SRFPYf98,2023-03-15 03:51:13,UCKrxgP_lTecqZ-ptb5iO8lA,hẹn với crush cuối tuần mà h phải ghé extrim gửi giặt giày trước để chuẩn bị rồi :<,0
lB3SRFPYf98,2023-03-15 03:57:40,UCFNs97TP49KbvxZVcuMI3vw,hay quá😍,0
lB3SRFPYf98,2023-03-15 03:57:44,UC4P99TrpiqHIEdxRi-zEKyw,Nghe cuốn quá,0
lB3SRFPYf98,2023-03-15 04:00:30,UCjIOrwf7WPNQmLUPCV3mtAQ,.,0
lB3SRFPYf98,2023-03-15 04:04:46,UCwsKpv0Phwb_l5dwox-We6g,đỉnh anh ơi,0
lB3SRFPYf98,2023-03-15 04:12:21,UCdOQszXOP0inKTXTJrexfag,"lyric hay quá, chúc bạn sớm thành công.",0
lB3SRFPYf98,2023-03-15 04:12:38,UCL8xbODBj637KIohFwd_vTQ,top 1 trending,0
lB3SRFPYf98,2023-03-15 04:14:24,UC1r4IdbE4Me6w0QnwE3aLgQ,Oiiiiii cuoi cùng cũbg raaaaaaa,0
lB3SRFPYf98,2023-03-15 04:15:41,UCYasb6Yhz6qsdxaKHJm2U_w,Riêng cảm nhận của mình thì mình không thích đem ca từ về gia đình liên quan đến tình yêu! 1 lí do không thuyết phục,0
lB3SRFPYf98,2023-03-15 04:17:20,UCL16jB9BQQ2XEp-5TL9xntw,Rất tuyệt vời chúc a đạt top trending,0
lB3SRFPYf98,2023-03-15 04:20:23,UC2T0C4pSicpBnYLfaZTMVkw,"giọng hay quá ạ, lời cũng rất ý nghĩa nói lên dc nỗi lòng bất lực trong tình yêu và mv cũng có nhiều cảnh quay chill quá ạ",0
lB3SRFPYf98,2023-03-15 04:29:09,UCbJmtaE2ilMw2KIhYl2NcrQ,Ra 1 ver chỉ mình nguyenn đi b,0
lB3SRFPYf98,2023-03-15 04:30:36,UCsbDNb6H2InXs5os40x5XRg,Hay quá anh ơi,0
lB3SRFPYf98,2023-03-15 04:31:46,UCsbDNb6H2InXs5os40x5XRg,Mong anh ra karaoke,0
lB3SRFPYf98,2023-03-15 04:33:35,UCm0J2zAbL_I9yU7vEokSEZA,thực sự bản nhạc này mình như được thấy mình trong đó Cảm ơn 2 bạn,0
lB3SRFPYf98,2023-03-15 04:42:20,UCOmK2CVfWdYrsmg56ml0qwg,Chờ bài ra để suy từ tiktok wua đây suy,0
lB3SRFPYf98,2023-03-15 04:49:59,UC9pRCrkadLMMVVWoxbQzZuA,Hay b,0
lB3SRFPYf98,2023-03-15 05:05:49,UCMUhxtjU9Zm5gYiRKqWMHag,"Đăng kí và theo dõi từ lúc anh  mới lập kênh bây giờ anh đã rất thành công với dòng nhạc này, bài hát đúng tâm trạng luôn hay quá anh guộcccc",0
lB3SRFPYf98,2023-03-15 05:06:10,UCrz-gntP1A9UoJAPFMYR1mA,"Lời hát nó quá thực đến tâm trạng của những bạn trẻ hiện nay, bài này hay đến nỗi mà rơi nước mắt luôn ạ",0
lB3SRFPYf98,2023-03-15 05:09:07,UCwPksHbWEzXqIGOjMFuKOcg,nghe từ demo qua đây ahuhu cuối cùng cũng ra rồi ạ,0
lB3SRFPYf98,2023-03-15 05:11:43,UCh070Uzd9A1HnYlyDWtPwWg,nghe hay thật sự,0
lB3SRFPYf98,2023-03-15 05:20:16,UCs8wRrZP5XC6TO-pcGnirWg,Chờ lâu lắm ròi giờ ra mừng quá đi,0
lB3SRFPYf98,2023-03-15 05:42:54,UCQqOHvyAMie1pHwgD1Gr5hg,Hayyy vảiiii aaaa,0
lB3SRFPYf98,2023-03-15 05:44:56,UCAN0CqXspo0tzBJ7Xkz3bSQ,tuyệt,0
lB3SRFPYf98,2023-03-15 05:49:17,UC93p1Zt6Vp4PnOyBPaNuHPA,anh làm thêm 1 ver anh hát đi ạ🥺,0
lB3SRFPYf98,2023-03-15 05:54:13,UCDCUCcnR-BxbsDtvMQKRVww,Bài này đúng ý v mấy bài khác nghe xog cứ phải có mấy đoạn rap,0
lB3SRFPYf98,2023-03-15 05:59:33,UCpttwZTHJG-ffg-vWYnDJMQ,dở,0
lB3SRFPYf98,2023-03-15 06:01:52,UCiWrYZnJwaHb5A6gnhI0VSA,meee :>,0
lB3SRFPYf98,2023-03-15 06:01:54,UCLlSs1r5PwZzmqlSCVCKO_A,Intro vào đầu hay quá,0
lB3SRFPYf98,2023-03-15 06:13:17,UCjLLKsraGItQ7LROrS_NUFg,mê bài này hóng ra MV mãi lun á tròiii,0
lB3SRFPYf98,2023-03-15 06:24:18,UCyG2dpBL8rKX9DGs1ikWZHQ,100k View gòiiiii,0
lB3SRFPYf98,2023-03-15 06:27:22,UCpy5wazptZ2464PAjJDWklg,hay lắm ạ ^^,0
lB3SRFPYf98,2023-03-15 06:38:40,UCSq63LYHE7q6ZOP61cejUqw,nghe rất hay rất đúng về tính yêu lứa tuổi học trò,0
lB3SRFPYf98,2023-03-15 06:42:08,UCSw7-wor4HyHcDa94Rd-Tzg,"mv rất đẹp , lời bài hát cũng như mv",0
lB3SRFPYf98,2023-03-15 07:06:06,UCCltTt_H5Vb4zWezo-aGSTw,Hay quá anh ơi,0
lB3SRFPYf98,2023-03-15 07:08:49,UCPhyM5oNvxCvGdCb2Uc9dkQ,Nghe tối h luôn á,0
lB3SRFPYf98,2023-03-15 07:11:07,UCP5vuews2hgwiCuxK9Bz8Eg,Thế hệ h chuộng nhạc thất tình nhiều lắm.,0
lB3SRFPYf98,2023-03-15 07:11:47,UCF4P_LT6JnP19S2IaVEngTQ,Thật sự cả 2 bài Anh Đã Từ Bỏ Rồi Đấy và Hẹn Em Ở Lần Yêu Thứ 2 rất đúng với tâm trạng của bản thân em và những gì em muốn nói. Rất cảm ơn anh vì thật sự đã ra mắt những bản nhạc vừa hay và vừa đúng với tâm trạng của em. Rất ủng hộ anh và sẽ mãi ủng hộ anh ở những tác phẩm tiếp theo ạ !,0
lB3SRFPYf98,2023-03-15 07:13:09,UCRInBlUY-K_CXShn7NbGGXw,nghe đi nghe lại không thấy chán luôn ạ,0
lB3SRFPYf98,2023-03-15 07:24:21,UCbyRrH1UGbna4Uh66gz0kYw,Rất tâm trạng và chill 🥺🥰,0
lB3SRFPYf98,2023-03-15 07:25:35,UCUCc5ZeLwR2WPwj3-7_C-BA,Từng câu từng chữ như viết về câu chuyện của mình...,0
lB3SRFPYf98,2023-03-15 07:29:30,UCju4TTDuxQ7_v-yiqkrT80w,"thuốc chữa lành tâm hồn đây rồi , cảm ơn các anh rất nhiều",0
lB3SRFPYf98,2023-03-15 07:33:11,UCSmeK7AA31oiG5NWZpX5LrA,"Anh Nguyên ơi, a cho em xin phép sử dụng bài hát để làm video nhạc nhé. Vô tình e nghe hay quá. E sẽ ghi rõ nguồn cho a ở phần mô tả của video.",0
lB3SRFPYf98,2023-03-15 07:37:01,UCFA46_asgYZgHa9B4Di3o4w,Thích nghe nhạc kiểu này,0
lB3SRFPYf98,2023-03-15 07:41:05,UCK_Q-90jc_bxMerdns9JHiA,Âm nhạc mang đến nhiều cảm xúc,0
lB3SRFPYf98,2023-03-15 07:52:26,UCjefmIiBYBbkWCBSGQUNUOA,Chúc em ngày càng thành công và cống hiến cho mn nhiều tác phẩm chất lượng như vậy nhé ❤ Nhưng mà Hóng bản kara này quá:3,0
lB3SRFPYf98,2023-03-15 08:08:04,UCitARcr4VVRUJk6z-tpRjkw,chia sẻ thật chút là mình rất thích bản demo mà bản này ra full ver 2 của b kia mình thất vọng thật ý,0
lB3SRFPYf98,2023-03-15 08:39:16,UCwnmav1fMUT6ShBMByAmroQ,tuyệt vơi ! chờ bài mới tiếp theo,0
lB3SRFPYf98,2023-03-15 08:45:16,UCK1RuWEp0Lgg0jWX5UsLnUA,"mv chưa chín theo mình cảm nhận, mới c3 , ngồi trên ghế nhà trường nên suy nghĩ chưa thể già dặn như vậy được đâu",0
lB3SRFPYf98,2023-03-15 09:06:26,UC33XNPEAQQjLIZRFhesVIXg,hẹn em ở lần thích thứ 2 :),0
lB3SRFPYf98,2023-03-15 09:47:36,UCAtE3-OrAn5NrpaVChWN7nA,14/3 ngày mình chính thức dừng lại với người ấy,0
lB3SRFPYf98,2023-03-15 09:53:10,UCrMTawaw3Fp2roXfNd_brSA,Quay ở bảo tàng hn đko nhỉ,0
lB3SRFPYf98,2023-03-15 10:05:40,UCKtcZ57_cvfOGZ0B3dnvv5Q,Hay quá ❤️,0
lB3SRFPYf98,2023-03-15 10:11:33,UC3cwBc7eW6XxIO8Dn-J2GDg,❤️,0
lB3SRFPYf98,2023-03-15 10:13:21,UCQFVJCTMNvY2IpwmKy7byEQ,"Cả ngày hôm nay mình đã replay bài này rất nhiều lần. Đã cuốn từ bản demo, đến giờ nghe trọn vẹn càng nhiều cảm xúc hơn.",0
lB3SRFPYf98,2023-03-15 10:26:46,UC-VekneM7BBOG1iXc_1G6Pg,"hic , mỗi lần cứ nghe bài này là khóc thôi…",0
lB3SRFPYf98,2023-03-15 10:38:55,UCcPEa42sRpoobQS_se0XuoA,Nghe bài này từ lúc nó còn demo chúc anh mau đc 1tr view,0
lB3SRFPYf98,2023-03-15 10:54:37,UCElxCGo5yvG_nArqs5RzIUQ,Tuyệt vời ông Mặt Trời,0
lB3SRFPYf98,2023-03-15 11:02:51,UCXoAqRpz83wLL3qzqGIn1cw,ôi hóng lâu lắm rồi,0
lB3SRFPYf98,2023-03-15 11:08:54,UCTc3-WTu2s34ZPk4B0TetLw,Không biết nói gì hơn quá hay và tuyệt,0
lB3SRFPYf98,2023-03-15 11:10:25,UCR7McXz5fZQE80Ki5EyuLDg,"Hay lắm lunn , top 1 trendding ạa❤🥰",0
lB3SRFPYf98,2023-03-15 11:21:56,UCMRnFCymD6loPkeDIZU_lsg,Có phải ngay lúc đầu...,0
lB3SRFPYf98,2023-03-15 11:47:56,UCHzUdIDN90Qchc0R2DtQ86w,Hay hay nè 😂🫡 lên luôn,0
lB3SRFPYf98,2023-03-15 11:49:15,UCHzUdIDN90Qchc0R2DtQ86w,Vài bữa tuyển em làm diễn viên đi kkk,0
lB3SRFPYf98,2023-03-15 11:49:36,UCHzUdIDN90Qchc0R2DtQ86w,Em hay thất tình nè 😂😂,0
lB3SRFPYf98,2023-03-15 11:50:05,UCjOp_ZUcpW1_MqNtcXETi2Q,Hay quá ạ,0
lB3SRFPYf98,2023-03-15 11:50:18,UCmPb4v1g2UeYLRJ3vLGP_hQ,Sao hát được bài dở thế,0
lB3SRFPYf98,2023-03-15 11:51:44,UCALatyDC1ZqvaJgyd3Xr9Lg,"hóng bản full lâu lắm roàiii, hay thật sự ❤",0
lB3SRFPYf98,2023-03-15 11:52:21,UCdntrkEyXYqmGHDteFOj6kg,chờ mãi mới ra bản full. Hay lắm hai anh ơi😀😀😀,0
lB3SRFPYf98,2023-03-15 11:59:25,UCZWu4xihUtODM1h-HMFtWkw,Cảm ơn và xin lỗi anh🌥,0
lB3SRFPYf98,2023-03-15 12:00:27,UC7fO8c1MghCUbmAl-Iz00LA,lyrics buồn muốn xỉu 😢,0
lB3SRFPYf98,2023-03-15 12:02:23,UCscr-6jo_aUh3FUGiQLlTtA,Hóng bài nì mãi luôn đó ạ . Quá tuyệt vời,0
lB3SRFPYf98,2023-03-15 12:25:20,UCZFB1lTn5k1VRfZGUlgjpJA,ra bài nào đúng hoàn cảnh bài đó :((,0
lB3SRFPYf98,2023-03-15 12:41:30,UC5xrxQX9H2Ismbnm_Wl4-8Q,Có hợp âm em xin với anh :<,0
lB3SRFPYf98,2023-03-15 13:04:01,UCk1ajpqNWGPMSDLoL9lsiyQ,hay quá !,0
lB3SRFPYf98,2023-03-15 13:09:29,UCXCMD7wklT4YfnrLOTq5KkQ,hay quá ạ,0
lB3SRFPYf98,2023-03-15 13:19:01,UCEaoyRkJM1qX2wIy1ZdZr-g,nghe chill thật sự :33,0
lB3SRFPYf98,2023-03-15 13:41:31,UCyuIlpfllE-Zy1KHx5oz3Dg,hay quá ạ!,0
lB3SRFPYf98,2023-03-15 13:41:36,UCUsqZZKig8cQNAmthlxa0wg,Giọng Nguyên nghe da diết nh,0
lB3SRFPYf98,2023-03-15 13:52:41,UCLWahiltUj7zfGgAhyP_OJg,hay quaaaaa,0
lB3SRFPYf98,2023-03-15 14:06:39,UCBGmFBRNhEUc40Hqji9wvSQ,Nghe suy luôn ấy chứ nhỉ ta ơi,0
lB3SRFPYf98,2023-03-15 14:06:58,UCrEEgVnazIAG5xNp9B1QMgA,Đợi mãi cuối cùng cũng ra full 🥰,0
lB3SRFPYf98,2023-03-15 14:08:20,UCapIlW8ZNgynHhabE3n6aDQ,chị trong mv này đẹp trai quó,0
lB3SRFPYf98,2023-03-15 14:22:33,UCOi_RUJ7JkkKpL-Y-s7fz9g,"Cảm ơn bài hát của 2 anh. Em đợi bài này mãi, bài này được ra đời em có cảm giác giống nyc em và em. Em chỉ muốn nói rằng anh ấy bỏ cuộc rồi mình em chỉ còn mình em thôi...",0
lB3SRFPYf98,2023-03-15 15:05:43,UClS7gXO02cUoAfuHraK9g8w,"Ui đợi mãi cũng ra rồi , ngay ngày sn ny luôn nma bh mới cày được.  Thật sự có quá nhiều điều trùng hợp cũng như là những tâm tư nói lên mqh của tụi mình hiện tại , mình hy vọng ny mình nghe được bài này và cũng có những suy nghĩ như lời bh , và chỉ khác là mình vẫn luôn bên cạnh họ chứ không muốn rời bỏ họ dù họ có than trách bản thân hay đang khó khăn , hy vọng tình yêu của mình có thể đổi lấy sự chân thành và cố gắng từ họ ❤",0
lB3SRFPYf98,2023-03-15 15:09:30,UCEQI65y1_W7Tm916tBixsrw,Hát thật sự,0
lB3SRFPYf98,2023-03-15 15:34:50,UC11cPy_-M8GAMteCjYuVlrg,có hợp âm ko mn ơi,0
lB3SRFPYf98,2023-03-15 15:36:39,UCEL-X58oNF6Z7zQUQgwLv5Q,❤,0
lB3SRFPYf98,2023-03-15 16:09:18,UCweAN4uSB-geCgMoBzncUHQ,"thật sự nghe xong mình lại cảm thấy nhẹ lòng đi rất nhiều, có lẽ là bài hát đã nói lên tâm trạng bấy lâu nay của mình. Có một chút buồn, một chút bâng quơ, một chút sợ hãi không dám đối diện với hiện thực..... phải vượt qua thôi",0
lB3SRFPYf98,2023-03-15 16:34:49,UCTD3D5zr5pNRR4wc-uURoPQ,💞,0
lB3SRFPYf98,2023-03-15 16:57:40,UCeVedjhAib9EmP_YBJ8HJJg,Không phải mình chê Vũ nhưng thực sự bài này mình cứ thấy nó sẽ hay hơn rất nhiều nếu chỉ có giọng của Nguyenn hoặc Nguyenn sẽ lại kết hợp với một đoạn Rap như đã từng làm với Aric. Mình đã bật khóc khi nghe Nguyenn bắt đầu hát đoạn xuất hiện ở demo. Cảm ơn Nguyen và team vì mang đến thứ âm nhạc cảm xúc này,0
lB3SRFPYf98,2023-03-15 17:08:02,UCN_rXyMGZAXfN7cGrhu1m_w,"Một lời nhắn muốn gửi đến anh của em! Bài hát này, thực sự e nghĩ nó viết như thay tâm trạng của anh lúc này.  Dành hết cả thành xuân cho nhau rồi, nhưng em rất tiếc không thể nắm tay anh đi tiếp chặng đường  của chúng ta.  Em đã không cần gì cả, đến bên anh và chỉ mong chúng ta sẽ trưởng thành bên nhau.  Cuối cùng thì có những đoạn đường ta phải bước một mình.  Em vẫn luôn yêu anh! Em thương anh! Chúc anh sẽ hạnh phúc mai sau.",0
lB3SRFPYf98,2023-03-15 17:30:11,UCxOZnmDBq7nPi07u-r3KxbA,🥰,0
lB3SRFPYf98,2023-03-15 17:30:14,UCxOZnmDBq7nPi07u-r3KxbA,🥰,0
lB3SRFPYf98,2023-03-15 17:31:54,UCaeiNlYuMMXHju79nKs0bRg,Tự hỏi thanh xuân năm đó đang ở nơi đâu? :(,0
lB3SRFPYf98,2023-03-15 17:38:16,UC9gex7ICYwXhZy67FzjSB5Q,"Anh chẳng có gì đặc biệt Vì em luôn so sánh anh với những người , những điều từng khiến em thấy bất an.",0
lB3SRFPYf98,2023-03-15 17:38:31,UCKT_gGAHgcfdJ9dPUD-Z_4Q,D.kies mãi iu,0
lB3SRFPYf98,2023-03-15 17:54:56,UC4JUDNVei04wuaJc-xz_4qA,🥰🥰🥰,0
lB3SRFPYf98,2023-03-15 18:11:58,UCbPgjZ7icEo7vCw5zCSFoRA,cảm ơn anh vì 2 bài hát thật sự rất hay ạ !,0
lB3SRFPYf98,2023-03-15 19:02:18,UCnT8NUFuwiqXDQrn2WXuUag,yêu,0
lB3SRFPYf98,2023-03-15 20:46:26,UCdwr67WHrX2nuOyo7h3lCww,Hay qa e trai,0
lB3SRFPYf98,2023-03-15 22:01:56,UC5m_ampxa1WODhI26OewWbg,Nhạc hay lắm cố lên nhé fighting🤍,0
